1101,Target - Senior Data Scientist - Supply Chain Domain (4-8 yrs),Hirist.tech,4-8 Yrs,4.0,8.0,,,,Bangalore / Bengaluru,20.0,hirist,,,"Data Science, Data Scientist, Python",
1102,Sr. Data Analyst,Instatalent Recruit Llp,12-21 Yrs,12.0,21.0,,,,Gurgaon / Gurugram,20.0,Naukri,,,"Power Bi, Data Analysis, Data Visualization",
1103,Data Management - Data Analyst-IT I,Varite,3-6 Yrs,3.0,6.0,₹ 6.5 - 10L/yr (AmbitionBox estimate),650000.0,1000000.0,Bangalore / Bengaluru,20.0,Naukri,,,"Technical services, Data management, SQL database",Estimated by Ambition Box
1104,CW Data Analyst III,Varite,0-8 Yrs,0.0,8.0,,,,Bangalore / Bengaluru,20.0,Naukri,,,"Operations research, Email marketing, Staffing",
1105,Data Analyst,Xoom Inc,0-2 Yrs,0.0,2.0,,,,"Chennai, Bangalore / Bengaluru",20.0,Naukri,,,"Data analysis, Analytical, Manager Technology",
1106,Business Analyst & Data Analyst (Data Science SQL Python),Techgimini,0-1 Yrs,0.0,1.0,₹ 4.75 - 7.5L/yr,475000.0,750000.0,Pune,20.0,Naukri,,,"Crm Systems, ERP, System Analysis",Salary Listed by Company
1107,"Fresher, Graduate, Recruitment, HR, MBA, Marketing, Communication",Iplace Consultant,0-2 Yrs,0.0,2.0,₹ 2 - 5L/yr,200000.0,500000.0,"Pune, Delhi/Ncr, Mumbai",20.0,Naukri,,,"BBA, BPO, Calling",Salary Listed by Company
1108,Data Analyst - US MNC (analytics),Aspyra Hr Services,3-8 Yrs,3.0,8.0,₹ 15 - 30L/yr,1500000.0,3000000.0,"Delhi/Ncr, Gurgaon / Gurugram, Noida",20.0,Naukri,,,"Business Intelligence, hql, Business Analytics",Salary Listed by Company
1109,Data Analyst,Evify,4-6 Yrs,4.0,6.0,,,,Surat,120.0,Naukri,4.3,4.0,"sql, python, r",
1110,Data Analyst,P. S International HR Consultants,0-4 Yrs,0.0,4.0,,,,Mumbai,365.0,Naukri,4.6,3.0,"SQL, Networking, Automation",
1111,Sr. Data Analyst,Bobble App,2-7 Yrs,2.0,7.0,,,,"Bangalore / Bengaluru, Gurgaon / Gurugram",1460.0,Naukri,3.5,11.0,"Data analysis, SQL, Analytical",
1112,Data Analyst | Lower Parel,Transformatrix Global,2-7 Yrs,2.0,7.0,₹ 15 - 20L/yr,1500000.0,2000000.0,Mumbai,22.0,Naukri,,,"Power Bi, Data Analysis, Big Data",Salary Listed by Company
1113,Data Analyst,Rocket Fast Recruiter,10-20 Yrs,10.0,20.0,₹ 90 - 225L/yr,9000000.0,22500000.0,Canada,22.0,Naukri,,,"Data Transformation, Data Enrichment, Data Wrangling",Salary Listed by Company
1114,Email Marketing Executive,Giri Consultancy,1-5 Yrs,1.0,5.0,₹ 1 - 7.5L/yr (AmbitionBox estimate),100000.0,750000.0,"Noida, New Delhi",22.0,Naukri,,,"email marketer, Email Marketing, bulk mailer",Estimated by Ambition Box
1115,Data Analyst | Mumbai,Hindco Recruitment Consultants,4-9 Yrs,4.0,9.0,₹ 0.13 - 38.85L/yr (AmbitionBox estimate),13000.0,3885000.0,"Navi Mumbai, Thane, Mumbai",22.0,Naukri,,,"Data Transformation, Matplotlib, Data Research",Estimated by Ambition Box
1116,Data Analyst,Bsharp Sales Enablers,1-3 Yrs,1.0,3.0,,,,Bangalore / Bengaluru,365.0,Naukri,3.8,6.0,"User management, Data Analyst, Usage",
1117,Frontend Data Analyst,Ultimez Technology Pvt Ltd,10-15 Yrs,10.0,15.0,,,,Remote,365.0,Naukri,3.6,8.0,"Javascript, Web development, Agile",
1118,Senior Data Analyst - Retail/FMCG (3-6 yrs),Zyoin Group,3-6 Yrs,3.0,6.0,,,,Bangalore / Bengaluru,30.0,iimjobs,4.0,1.0,"Data Analytics, Analytics, Data Modeling",
1119,Lead Data Analyst - Pricing & Revenue Management (7-10 yrs),CxSearch Global Partners,7-10 Yrs,7.0,10.0,,,,"Mumbai, Bangalore / Bengaluru",23.0,iimjobs,,,"Analytics, Data Analytics, Python",
1120,Lead - Data Analyst - Global Logistics Industry (7-11 yrs),Cxsearch Global Partners,7-11 Yrs,7.0,11.0,,,,Bangalore / Bengaluru,23.0,iimjobs,,,"Analytics, Data Analytics, SQL",
1121,Data Analyst_ MNC Bank_ Bengaluru,Novel Financial Solutions,3-8 Yrs,3.0,8.0,₹ 10 - 20L/yr,1000000.0,2000000.0,"Chennai, Bangalore / Bengaluru",23.0,Naukri,,,"Control Testing Automation, SAS, Shell Scripting",Salary Listed by Company
1122,Data Analyst,Jobs Desk,2-5 Yrs,2.0,5.0,₹ 3 - 4L/yr,300000.0,400000.0,New Delhi,23.0,Naukri,,,Advanced Excel,Salary Listed by Company
1123,Data Analyst,Comaea Consulting,3-8 Yrs,3.0,8.0,₹ 10 - 12L/yr,1000000.0,1200000.0,Mumbai,23.0,Naukri,,,"Business Intelligence, Power Bi, Tableau",Salary Listed by Company
1124,Data Analyst - Python & Pyspark,D2N SOLUTIONS,3-4 Yrs,3.0,4.0,₹ 0.2 - 27L/yr (AmbitionBox estimate),20000.0,2700000.0,New Delhi,23.0,Naukri,,,"HR Generalist, HRBP, Data Analyst",Estimated by Ambition Box
1125,Data Analyst - Python & Pyspark,D2N SOLUTIONS,5-10 Yrs,5.0,10.0,,,,Bangalore Rural,23.0,Naukri,,,"Pyspark, Java, Scala",
1126,Data Analyst - Python & Pyspark,D2N SOLUTIONS,5-10 Yrs,5.0,10.0,,,,Hyderabad / Secunderabad,23.0,Naukri,,,"Pyspark, Java, Scala",
1127,Sr. Data Analyst,Rudra Research And Analytics Llp,5-6 Yrs,5.0,6.0,₹ 6 - 6.5L/yr,600000.0,650000.0,Pune,23.0,Naukri,,,"Data Validation, Pivot Table, Power Bi",Salary Listed by Company
1128,Data Analyst - Python & Pyspark,D2N SOLUTIONS,5-10 Yrs,5.0,10.0,,,,Pune,23.0,Naukri,,,"Pyspark, Java, Scala",
1129,DATA Analyst/ Python Scripting/ Pyspark & SQL,D2N SOLUTIONS,6-11 Yrs,6.0,11.0,,,,Bangalore Rural,23.0,Naukri,,,"Pyspark, Cloud, Bi Tools",
1130,Data Analyst - Python & Pyspark,D2N SOLUTIONS,5-10 Yrs,5.0,10.0,,,,Bangalore Rural,23.0,Naukri,,,"Pyspark, Scala, Data Analysis",
1131,Data Analyst - Python & Pyspark,D2N SOLUTIONS,5-10 Yrs,5.0,10.0,,,,Hyderabad / Secunderabad,23.0,Naukri,,,"Pyspark, Java, Scala",
1132,Data  Analyst - Python Scripting / PySpark & SQL,D2N SOLUTIONS,6-11 Yrs,6.0,11.0,₹ 2.95 - 12.1L/yr (AmbitionBox estimate),295000.0,1210000.0,Pune,23.0,Naukri,,,"DWH, Power BI, Python Scripting",Estimated by Ambition Box
1133,Data Analyst - OWS,D2N SOLUTIONS,5-9 Yrs,5.0,9.0,₹ 2.2 - 15L/yr (AmbitionBox estimate),220000.00000000003,1500000.0,Pune,23.0,Naukri,,,"Screening, EDQ, Oracle Watch",Estimated by Ambition Box
1134,Sr Data Analyst- SQL,ARA Resources,5-10 Yrs,5.0,10.0,₹ 12 - 20L/yr,1200000.0,2000000.0,Bangalore / Bengaluru,23.0,Naukri,,,"QC, Data Analysis, SQL Queries",Salary Listed by Company
1135,Business Analytics,Symbiosis Management Consultants,8-13 Yrs,8.0,13.0,,,,Mumbai,23.0,Naukri,,,"AZURE, MACHINE LEARNING, CLOUD",
1136,MIS / Data Analyst,Kmspl Services,3-8 Yrs,3.0,8.0,₹ 4 - 4.75L/yr,400000.0,475000.0,Bhubaneshwar,23.0,Naukri,,,"MIS, MIS Operations, Data Management",Salary Listed by Company
1137,Data Analyst,Ducker Worldwide Management Consulting Pvt. Ltd,1-3 Yrs,1.0,3.0,,,,Bangalore / Bengaluru,60.0,Naukri,3.9,5.0,"Consulting, Market research, Analytics",
1138,Data Analyst - Azure (5-9 yrs),Talent join,,,,,,,,24.0,hirist,,,,
1139,Looking For Data Analyst (Qualtrics & SAP SuccessFactors),CDI Solutions,3-5 Yrs,3.0,5.0,₹ 1.25 - 37L/yr (AmbitionBox estimate),125000.0,3700000.0,Bangalore / Bengaluru,24.0,Naukri,,,"Excel, business intelligence platforms, Power BI",Estimated by Ambition Box
1140,Data analyst,iProPal (ALLPS),1-3 Yrs,1.0,3.0,,,,Remote,24.0,Naukri,,,"Data analytics, Data Analyst, Internship",
1141,Data Analyst,HealthSy,1-3 Yrs,1.0,3.0,,,,Coimbatore,24.0,Naukri,,,"Backend, Data analysis, Data management",
1142,Sr. Data Analysts,EGO FLOORING PVT. LTD.,2-6 Yrs,2.0,6.0,,,,India,1460.0,Naukri,3.3,12.0,"Consulting, Industry research, Management",
1143,"Sr. Data Analysts,",NAVEDAS TECHNOLOGY SOLUTIONS PRIVATE LIMITED,1-6 Yrs,1.0,6.0,,,,"Chennai, Pune, New Delhi
													+4 more",1460.0,Naukri,3.8,6.0,"Consulting, Recruitment, Industry research",
1144,Need JD Edwards Financial Data Analyst (for 3 year contract),Rankskills Knowledge International,6-11 Yrs,6.0,11.0,,,,"Doha, Qatar",24.0,Naukri,,,"Visualization, Financial Reporting, Financial Analytics",
1145,Business Analyst  In Bpo,Subhadra Jobs Consultancy,6-11 Yrs,6.0,11.0,₹ 4 - 9L/yr,400000.0,900000.0,Bangalore Rural,24.0,Naukri,,,"Excel, Business Analytics, Data Manipulation",Salary Listed by Company
1146,Data Analyst/Senior Data Analyst - Denodo Platform (3-8 yrs),HeadPro Consulting LLP,3-8 Yrs,3.0,8.0,,,,Bangalore / Bengaluru,60.0,hirist,,,"Data Analyst, Data Visualization, Data Governance",
1147,Data Analyst,Randstad,1-5 Yrs,1.0,5.0,₹ 0.094 - 37L/yr (AmbitionBox estimate),9400.0,3700000.0,"Mumbai suburbs, Mumbai, Mumbai",25.0,Naukri,,,"Excel, Google Suite, Data Analysis",Estimated by Ambition Box
1148,Senior Executive - Data Analyst,HDI outsourcing Services Private Limited,6-8 Yrs,6.0,8.0,₹ 4 - 6L/yr,400000.0,600000.0,Faridabad,25.0,Naukri,,,"Excel, Data Analysis, MS Office",Salary Listed by Company
1149,Sr. Azure Data Analyst,Fusemachines,3-7 Yrs,3.0,7.0,,,,Pune,60.0,Naukri,5.0,1.0,"SQL, MySQL, Project management",
1150,Data analyst trainer,Merida Tech Minds (opc),1-6 Yrs,1.0,6.0,₹ 1 - 1.5L/yr,100000.0,150000.0,Bangalore / Bengaluru,25.0,Naukri,,,"Data Analysis, Teaching skills",Salary Listed by Company
1151,Data Analyst professionals are required,Saino Koyo Consulting,5-10 Yrs,5.0,10.0,₹ 20 - 32.5L/yr,2000000.0,3250000.0,Hyderabad / Secunderabad,25.0,Naukri,,,"Analytical Skills, Excellent Communication In English, Data Analysis",Salary Listed by Company
1152,Big Data Engineer - AWS Platform (5-10 yrs),TCCS,5-10 Yrs,5.0,10.0,,,,"Bangalore / Bengaluru, Gurgaon / Gurugram",30.0,hirist,1.8,10.0,"Big Data, AWS, Data Warehousing",
1153,Urgent Hiring For Digital Marketing Analyst with a Product based MNC,Peoplefy Infosolutions,4-9 Yrs,4.0,9.0,,,,Pune,25.0,Naukri,,,"Powerbi, Digital Marketing Analyst, Data Analyst",
1154,Business Analyst,Nexpro247,0-5 Yrs,0.0,5.0,,,,"Chennai, Pune, Mumbai",25.0,Naukri,,,"automation framework, python, analytical",
1155,Data Analyst,Indian Internet Solutions,1-3 Yrs,1.0,3.0,,,,Aurangabad,30.0,Naukri,2.8,4.0,Data Analyst,
1156,G.M (Sales & Marketing),Damden Properties,10-15 Yrs,10.0,15.0,,,,Bangalore / Bengaluru,2190.0,Naukri,5.0,2.0,"Customer service, Client servicing, Report generation",
1157,Senior Data Analyst - AWS,Expedite Technology Solutions LLC,2-4 Yrs,2.0,4.0,,,,Bangalore / Bengaluru,270.0,Naukri,5.0,2.0,"Senior Data Analyst, AWS, Data analysis",
1158,Data Analyst,NIG SOFTWARE SOLUTION,3-8 Yrs,3.0,8.0,,,,Salem,150.0,Naukri,5.0,2.0,"Troubleshooting, Data analysis, Consulting",
1159,Informatica Data Analyst - Data Quality (6-10 yrs),RapidBraiins,6-10 Yrs,6.0,10.0,,,,Bangalore / Bengaluru,26.0,hirist,,,"Data Quality, Informatica, Data Analyst",
1160,Manager - Data Analyst - MR Firm (7-9 yrs),iTaap,7-9 Yrs,7.0,9.0,,,,"Mumbai, Gurgaon / Gurugram",60.0,iimjobs,5.0,1.0,"Analytics, Data Analytics, Data Management",
1161,Data Analyst - TSI,BP INCORPORATE INTERNATIONAL.,1-3 Yrs,1.0,3.0,,,,Pune,26.0,Naukri,,,"SAP, Manager Quality Assurance, Maximo",
1162,Data Analyst - (For Warehouse OPs) at Andher East.,Job Search,2-7 Yrs,2.0,7.0,₹ 0.16 - 1.45L/yr (AmbitionBox estimate),16000.0,145000.0,Mumbai,26.0,Naukri,,,"Sales Dashboard, Power Bi, Coding",Estimated by Ambition Box
1163,Online Data Analyst-ETL,Resource Infrastructure Management India,6-8 Yrs,6.0,8.0,₹ 8 - 12L/yr,800000.0,1200000.0,Bangalore / Bengaluru,26.0,Naukri,,,"Azure, API, ETL",Salary Listed by Company
1164,Data Analyst,Collabera Technologies,5-10 Yrs,5.0,10.0,₹ 2 - 28L/yr (AmbitionBox estimate),200000.0,2800000.0,Bangalore / Bengaluru,26.0,Naukri,,,"SQL Queries, Informatica, Data Warehousing",Estimated by Ambition Box
1165,Warehouse Operations & Data Analysis-MNC into Supply Chain,Nexus Manpower Solutions,3-8 Yrs,3.0,8.0,₹ 6.5 - 8L/yr,650000.0,800000.0,Bangalore / Bengaluru,26.0,Naukri,,,"data analysis, supply chain, hub operations",Salary Listed by Company
1166,Data Analyst,Fedelty Healthcare Pvt Ltd,0-2 Yrs,0.0,2.0,₹ 1 - 2.25L/yr,100000.0,225000.0,Mumbai,26.0,Naukri,,,"Analytical Skills, Data Mining, Data Cleansing",Salary Listed by Company
1167,Data Analyst,Sea and Beyond,1-4 Yrs,1.0,4.0,,,,Mumbai,26.0,Naukri,,,"Data analysis, tableau, Maritime",
1168,Azure Data Analyst,Ascendion Engineering,4-7 Yrs,4.0,7.0,₹ 0.3 - 9.5L/yr (AmbitionBox estimate),30000.0,950000.0,"Chennai, Pune, Bangalore / Bengaluru",26.0,Naukri,,,"azure cost management, Azure, data analysis",Estimated by Ambition Box
1169,Senior Data Analyst - Reporting & Visualization (5-8 yrs),Seikor,5-8 Yrs,5.0,8.0,,,,Hyderabad / Secunderabad,27.0,hirist,,,"Data Analyst, Data Analytics, Data Visualization",
1170,Software Engineer/Data Analyst - R/Python (4-8 yrs),Cryzdal,4-8 Yrs,4.0,8.0,,,,Haryana,60.0,hirist,5.0,1.0,"Data Analyst, Python, R",
1171,Convosight - Senior Data Analyst - Power BI/Tableau (5-7 yrs),Convosight,5-7 Yrs,5.0,7.0,,,,"Mumbai, Bangalore / Bengaluru, Gurgaon / Gurugram",60.0,hirist,2.7,19.0,"Data Analyst, Data Analytics, Power BI",
1172,Data Analyst - Apparel Industry@Noida,Talentzq,3-6 Yrs,3.0,6.0,₹ 8 - 9.5L/yr,800000.0,950000.0,Noida,27.0,Naukri,,,"Retail Analytics, Power Bi, Data Visualization",Salary Listed by Company
1173,HR Data Analyst,Peoplefy Infosolutions,6-11 Yrs,6.0,11.0,,,,Navi Mumbai,27.0,Naukri,,,"Excel, Power Bi, Data Analysis",
1174,GBS Material Master Data Analyst (MDM),Smith & Nephew,5-10 Yrs,5.0,10.0,,,,Pune,27.0,Naukri,,,"Equity, SAP, Informatica",
1175,Data Analyst,Transformatrix Global,5-10 Yrs,5.0,10.0,₹ 5 - 10L/yr,500000.0,1000000.0,Bangalore Rural,27.0,Naukri,,,"Data Science, Data Mining, Data Analytics",Salary Listed by Company
1176,Data Analyst,The IT Mind,5-10 Yrs,5.0,10.0,,,,Chennai,270.0,Naukri,3.1,10.0,"SQL, Agile, Scrum",
1177,Data Analyst,Nurture Software Solutions Pvt Ltd,3-6 Yrs,3.0,6.0,,,,Bangalore / Bengaluru,365.0,Naukri,1.7,34.0,"Manager Quality Control, Analytical, Operations",
1178,Business Analyst/ Data Analyst,Aptus Data Labs,2-7 Yrs,2.0,7.0,,,,Bangalore / Bengaluru,365.0,Naukri,2.7,4.0,"CRM, SQL, SMS",
1179,Data Analyst,Tentacle solutions,8-13 Yrs,8.0,13.0,,,,Remote,730.0,Naukri,4.1,3.0,"Javascript, Jquery, Css",
1180,Data Analyst,Billow People Services,1-3 Yrs,1.0,3.0,₹ 0.1 - 45L/yr (AmbitionBox estimate),10000.0,4500000.0,Bangalore / Bengaluru,27.0,Naukri,,,"SQL Queries, ETL, Python",Estimated by Ambition Box
1181,Data Analyst - SQL/Azure (3-6 yrs),GM INFOTECH,3-6 Yrs,3.0,6.0,,,,"Mumbai, Navi Mumbai",60.0,hirist,4.4,2.0,"Data Analyst, SQL, Power BI",
1182,Data Analyst - MIS - Mutual Fund (5-6 yrs),Arin Consultancy Pvt. Ltd.,5-6 Yrs,5.0,6.0,,,,Mumbai,30.0,iimjobs,3.0,1.0,"Analytics, Data Analytics, Consulting - BFSI",
1183,Data Analyst,Valocity,1-4 Yrs,1.0,4.0,,,,New Delhi,30.0,Naukri,2.3,6.0,"Data Analyst, Troubleshooting, Analytics",
1184,Solution Manager - Power BI (7-10 yrs),GM INFOTECH,7-10 Yrs,7.0,10.0,,,,Pune,60.0,hirist,4.4,2.0,"Power BI, Data Analyst, Solution Design",
1185,Data Processing Analyst - Research Operations,Savanta,1-4 Yrs,1.0,4.0,,,,"New Delhi, Noida",1095.0,Naukri,3.5,7.0,"Career development, Data analysis, Diversity and Inclusion",
1186,Senior Qualtrics Data Analyst,Anika Technologies,7-10 Yrs,7.0,10.0,₹ 3.24 - 28L/yr (AmbitionBox estimate),324000.0,2800000.0,Bangalore / Bengaluru,29.0,Naukri,,,"Data Manipulation, Implementing Data Models, SAP CRM",Estimated by Ambition Box
1187,Online Data Analyst -ETL,Ontrack Hr Services,6-8 Yrs,6.0,8.0,₹ 15 - 18L/yr,1500000.0,1800000.0,Bangalore / Bengaluru,29.0,Naukri,,,"Data Automation, Cloud Platforms, Api Integration",Salary Listed by Company
1188,Data Analyst,SKY Jobs Hr Services,5-10 Yrs,5.0,10.0,₹ 12 - 22L/yr,1200000.0,2200000.0,"Chennai, Pune, Bangalore Rural
													+1 more",29.0,Naukri,,,"SAS, Power Bi, ANMF",Salary Listed by Company
1189,Financial Data Analyst || Hybrid || Bangalore,Sunrise Job Consultancy,1-6 Yrs,1.0,6.0,₹ 1 - 6L/yr,100000.0,600000.0,Bangalore / Bengaluru,29.0,Naukri,,,"Financial Analysis, Excel, Accounting",Salary Listed by Company
1190,Business Analyst in Data Analytics,Mount Talent Consulting,3-8 Yrs,3.0,8.0,₹ 5.5 - 15L/yr,550000.0,1500000.0,Chennai,29.0,Naukri,,,"Data Modelling, Business Analyst, VBA",Salary Listed by Company
1191,Data Analyst | Forecasting | Power BI | WFH | US MNC | Gurgaon,Impetus Consultants,3-8 Yrs,3.0,8.0,₹ 4.5 - 8.5L/yr,450000.0,850000.0,Gurgaon / Gurugram,29.0,Naukri,,,"Data Science, Power BI, Capacity Planning",Salary Listed by Company
1192,Data Analyst - US MNC (analytics),Aspyra Hr Services,3-8 Yrs,3.0,8.0,₹ 15 - 30L/yr,1500000.0,3000000.0,"Bangalore / Bengaluru, Hyderabad / Secunderabad",29.0,Naukri,,,"Business Intelligence, hql, Business Analytics",Salary Listed by Company
1193,Data Analyst,ELEVATE Global,1-3 Yrs,1.0,3.0,,,,Bangalore / Bengaluru,60.0,Naukri,4.2,3.0,"Consulting, Market research, Analytics",
1194,Senior IT Data Analyst - Data Visualization Tools (3-15 yrs),Dotflick Solutions,3-15 Yrs,3.0,15.0,,,,"Guwahati, Orrisa, Patiala
													+10 more",30.0,hirist,,,"Big Data, Data Analyst, Data Analytics",
1195,Lead Data Analyst (Managing Database)_Immediate_Bangalore_WFO,HR Central,4-6 Yrs,4.0,6.0,₹ 5 - 35L/yr (AmbitionBox estimate),500000.0,3500000.0,Bangalore / Bengaluru,30.0,Naukri,,,"Data Validation, Data Compilation, Database Management",Estimated by Ambition Box
1196,Urgent hiring For Data Analyst  in leading MNC (Third party payroll),Altezzasys,6-11 Yrs,6.0,11.0,₹ 0.15 - 36L/yr (AmbitionBox estimate),15000.0,3600000.0,"Chennai, Pune",30.0,Naukri,,,"Kubeflow, AWS Lambdas, Amazon Redshift",Estimated by Ambition Box
1197,ASSISTANT DATA ANALYST,Aditya Pharmacy,0-2 Yrs,0.0,2.0,,,,Hyderabad / Secunderabad,730.0,Naukri,3.5,7.0,Data Analyst,
1198,SupplyChain Consultant(techno function)(Supply Chan Data Analyst) WFH,INTELLI SEARCH,3-8 Yrs,3.0,8.0,₹ 8 - 18L/yr,800000.0,1800000.0,Bangalore / Bengaluru,30.0,Naukri,,,"delivery, confluence, Ecommerce",Salary Listed by Company
1199,Quantitative Analyst/ Data Analyst,Randstad,1-6 Yrs,1.0,6.0,,,,Ahmedabad,30.0,Naukri,,,"Statistics, Python",
1200,Data Analyst,Dynpro,2-5 Yrs,2.0,5.0,₹ 2 - 5.5L/yr,200000.0,550000.0,Hyderabad / Secunderabad,30.0,Naukri,,,"Data Analysis, Data Cleansing, Advanced Excel",Salary Listed by Company
1201,BIU Manager- ATM _ Bank,V Konnect,5-10 Yrs,5.0,10.0,₹ 12 - 17L/yr,1200000.0,1700000.0,Mumbai,30.0,Naukri,,,"Business Intelligence, predictive modelling, portfolio",Salary Listed by Company
1202,HR Data Analyst/Analytics,Peoplefy Infosolutions,7-12 Yrs,7.0,12.0,,,,Navi Mumbai,30.0,Naukri,,,"Excel, Data Management, Data Analysis",
1203,Data Analyst/Managers-2074,Live Connections,2-7 Yrs,2.0,7.0,₹ 7 - 9L/yr,700000.0,900000.0,Chennai,30.0,Naukri,,,"Unica Campaign, Power Bi, Data Mining",Salary Listed by Company
1204,SR.Engineer-Data Analyst/ Dx Consultant,Alliance Placement Solutions,5-6 Yrs,5.0,6.0,₹ 5.5 - 7L/yr,550000.0,700000.0,Bawal,30.0,Naukri,,,"Business Analyst, system design, Data Analyst",Salary Listed by Company
1205,Data Analytic | Fresher | Business Analytics,Creative Hands HR,2-5 Yrs,2.0,5.0,₹ 2.5 - 6L/yr,250000.0,600000.0,"Chennai, Bangalore / Bengaluru, Hyderabad / Secunderabad",30.0,Naukri,,,"excel, Business Research, freshers",Salary Listed by Company
1206,Data Analyst - Looker Studio Expert,Jay Consulting,2-7 Yrs,2.0,7.0,₹ 3 - 7L/yr,300000.0,700000.0,Jaipur,30.0,Naukri,,,"Google Data Studio, Power Bi, Excel Dashboards",Salary Listed by Company
1207,Data Analyst,Access Partners,4-7 Yrs,4.0,7.0,₹ 0.13 - 60L/yr (AmbitionBox estimate),13000.0,6000000.0,India,30.0,Naukri,,,"Data Analytics, MIS Reporting",Estimated by Ambition Box
1208,Data Analyst,Supplymint,1-3 Yrs,1.0,3.0,,,,Gurgaon / Gurugram,30.0,Naukri,,,Data Analyst,
1209,We Are Hiring Full stack Python Developer ( Business & Data Analyst),Coriolis Tech,0-1 Yrs,0.0,1.0,₹ 4.25 - 7L/yr,425000.0,700000.0,Pune,30.0,Naukri,,,c,Salary Listed by Company
1210,Lead Analyst - Market Insights - Diversity Role,Flexability Hr Solutions,7-12 Yrs,7.0,12.0,₹ 15 - 27.5L/yr,1500000.0,2750000.0,Pune,30.0,Naukri,,,"market Analyst, Power Bi, market insight",Salary Listed by Company
1211,Data Analyst,Mits Solution,5-10 Yrs,5.0,10.0,₹ 20 - 25L/yr,2000000.0,2500000.0,Bangalore Rural,30.0,Naukri,,,"Power Bi, Snowflake, ETL",Salary Listed by Company
1212,Data Analyst,Material Depot,2-5 Yrs,2.0,5.0,,,,Bangalore / Bengaluru,270.0,Naukri,3.7,5.0,"Manager Quality Assurance, Troubleshooting, Data mining",
1213,Software Developer,Scientiaarc Solutions Ltd,1-5 Yrs,1.0,5.0,,,,Kanyakumari,240.0,Naukri,4.7,2.0,"cloud architect, big data analyst, Simulink",
1214,Sr. Data Analyst,GForce Consulting Solutions,3-7 Yrs,3.0,7.0,,,,Gurgaon / Gurugram,365.0,Naukri,4.2,3.0,"SQL, Python, Business intelligence",
1215,Healthcare Data Analyst,Tech Rakers,6-9 Yrs,6.0,9.0,₹ 15 - 17L/yr,1500000.0,1700000.0,Hyderabad / Secunderabad,30.0,Naukri,1.0,2.0,"data analysis, Power BI, SAS",Salary Listed by Company
1216,Data Analyst- Graph Analytics-Neo4j,Energik InfoSystem,2-6 Yrs,2.0,6.0,₹ 18 - 25L/yr,1800000.0,2500000.0,Noida,30.0,Naukri,,,"APOC Library, Neo4J, Cypher",Salary Listed by Company
1217,Data Analyst- Graph Analytics-Neo4j,Energik InfoSystem,2-6 Yrs,2.0,6.0,₹ 18 - 25L/yr,1800000.0,2500000.0,Pune,30.0,Naukri,,,"APOC Library, Neo4J, Cypher",Salary Listed by Company
1218,Data Analyst- Graph Analytics-Neo4j,Energik InfoSystem,2-6 Yrs,2.0,6.0,₹ 18 - 25L/yr,1800000.0,2500000.0,Bangalore / Bengaluru,30.0,Naukri,,,"APOC Library, Neo4J, Cypher",Salary Listed by Company
1219,Data Analyst- Graph Analytics-Neo4j,Energik InfoSystem,2-6 Yrs,2.0,6.0,₹ 18 - 25L/yr,1800000.0,2500000.0,Gurgaon / Gurugram,30.0,Naukri,,,"APOC Library, Neo4J, Cypher",Salary Listed by Company
1220,Data Analyst - US MNC (analytics),Aspyra Hr Services,3-8 Yrs,3.0,8.0,₹ 15 - 30L/yr,1500000.0,3000000.0,"Delhi/Ncr, Gurgaon / Gurugram, Noida",30.0,Naukri,,,"Business Intelligence, hql, Business Analytics",Salary Listed by Company
1221,Azure Data Analyst,Ascendion Engineering,4-9 Yrs,4.0,9.0,₹ 12 - 22L/yr,1200000.0,2200000.0,"Chennai, Bangalore / Bengaluru, Hyderabad / Secunderabad",30.0,Naukri,,,"Azure, Snowflake, Data Analysis",Salary Listed by Company
1222,Data Analyst with a US Based Product Company-Jaipur,Seventh Contact Hiring Solutions,6-10 Yrs,6.0,10.0,,,,Jaipur,30.0,Naukri,,,"SED, Shell Scripting, AWK",
1223,Sr. Data Analyst - SQL / ETL,People Connection,9-14 Yrs,9.0,14.0,₹ 3.2 - 13L/yr (AmbitionBox estimate),320000.0,1300000.0,Mumbai,30.0,Naukri,,,"shared services, data analysis, data analytics",Estimated by Ambition Box
1224,"Fresher, Graduate, Recruitment, HR, MBA, Marketing, Communication",Iplace Consultant,0-2 Yrs,0.0,2.0,₹ 2 - 5L/yr,200000.0,500000.0,"Chennai, Pune, Mumbai",30.0,Naukri,,,"BBA, BPO, Calling",Salary Listed by Company
1225,Data Analyst 1,Thoughtgen Analytics,0-2 Yrs,0.0,2.0,₹ 3.5 - 5L/yr,350000.0,500000.0,Mumbai Suburbs,30.0,Naukri,,,"Excel, Power Bi, Tableau",Salary Listed by Company
1226,Data Analyst/Data Tester,Placenet Consultants,4-6 Yrs,4.0,6.0,,,,Hyderabad / Secunderabad,30.0,Naukri,,,"Testing Tools, sparksql, data tester",
1227,Data Analyst,CRE Matrix,0-4 Yrs,0.0,4.0,,,,Mumbai,60.0,Naukri,4.6,2.0,"Data entry, Leasing, CRE",
1228,RBHU Analytics - Data Analyst Trainee - R/Python (0-2 yrs),RBHU ETG Private Limited,0-2 Yrs,0.0,2.0,,,,Mumbai,60.0,hirist,2.9,4.0,"Data Analyst, R, Python",
1229,Data Analyst,Golden Gate Battery,2-6 Yrs,2.0,6.0,,,,Cochin/Ernakulam/Kochi,30.0,Naukri,,,"Data analysis, Malayalam, Python",
1230,Data Analyst,Tyootr,1-3 Yrs,1.0,3.0,,,,Bangalore / Bengaluru,30.0,Naukri,,,"data mining, data cleansing, data analysis",
1231,Data Analyst,Facts N Data,3-6 Yrs,3.0,6.0,,,,Noida,60.0,Naukri,5.0,1.0,"metadata, python, data analysis",
1232,Data Analyst(0 Experience Required),Peroptyx,0-5 Yrs,0.0,5.0,,,,Delhi/Ncr,30.0,Naukri,,,"Data Analysis, Data Analytics, Data Mapping",
1233,Associate Data Analyst,Talentas Technology Private Limited,1-2 Yrs,1.0,2.0,,,,Hyderabad / Secunderabad,365.0,Naukri,4.7,2.0,"Python, Stored procedures, Machine learning",
1234,Data Analyst,Aryavart Institute of Technology,1-3 Yrs,1.0,3.0,,,,"Kanpur, Supaul, Patna
													+1 more",60.0,Naukri,5.0,1.0,"Data analysis, Data mining, Analytical",
1235,Data Analyst - Python/R/SQL (5-7 yrs),sm it services,5-7 Yrs,5.0,7.0,,,,Thane,30.0,hirist,,,"Data Analytics, Data Analyst, Dashboard Design",
1236,Senior Data Analyst - Business Intelligence (3-5 yrs),Insight Advisors Private Limited,3-5 Yrs,3.0,5.0,,,,"International/Overseas, Saudi arabia",60.0,hirist,5.0,1.0,"SQL, Power BI, Python",
1237,BI Data Analyst,sortimat technology pvt. ltd.,2-3 Yrs,2.0,3.0,,,,Bangalore / Bengaluru,30.0,Naukri,,,"PLM, ERP, Technical management",
1238,Data Analyst,ASSA ABLOY Entrance Systems,5-7 Yrs,5.0,7.0,,,,Chennai,30.0,Naukri,,,"python, data analysis, business requirements",
1239,Data Analyst - Python/SQL (2-5 yrs),Whizz HR,2-5 Yrs,2.0,5.0,,,,Bangalore / Bengaluru,60.0,hirist,3.3,7.0,"Data Analyst, Data Analytics, Python",
1240,Human Resources Data Analyst II,Hillenbrand,2-4 Yrs,2.0,4.0,,,,Coimbatore,150.0,Naukri,3.7,4.0,"Analytics, Automation, Continuous improvement",
1241,Senior Data Analyst,Pearlsoft Technology,4-9 Yrs,4.0,9.0,,,,Chennai,210.0,Naukri,3.6,5.0,"Senior Data Analyst, Oracle, SSIS",
1242,Events Data Analyst,Bloomberg UTV,1-2 Yrs,1.0,2.0,,,,Mumbai,365.0,Naukri,4.0,3.0,"Data Analyst, Customer support, Data analysis",
1243,Research Analyst,"MarketJoy, Inc.",2-6 Yrs,2.0,6.0,,,,Pune,365.0,Naukri,3.4,6.0,"Market research, Data analysis, Data mining",
1244,Senior Data Analyst,Luminar Technologies,0-4 Yrs,0.0,4.0,,,,New Delhi,365.0,Naukri,4.1,3.0,"Automotive, Manager Internal Audit, Data Analyst",
1245,Senior Data Analyst,InsightsE,1-2 Yrs,1.0,2.0,,,,Cochin/Ernakulam/Kochi,1095.0,Naukri,4.3,2.0,"Data analysis, SAS, Data Analyst",
1246,Data Analyst - SQL/Python (2-4 yrs),Yo HR Consultancy,2-4 Yrs,2.0,4.0,,,,Mumbai,60.0,hirist,5.0,1.0,"Data Analyst, Data Analytics, SQL",
1247,Data Analyst,Sea and Beyond,1-2 Yrs,1.0,2.0,,,,"Navi Mumbai, Mumbai",30.0,Naukri,,,"Macros, Photoshop, Adobe",
1248,Marketing /CRM Data Analyst,Marrina decisions,2-5 Yrs,2.0,5.0,,,,Remote,300.0,Naukri,4.0,3.0,"CRM, Project management, Analytics",
1249,Data Analyst,Hudson Data,2-5 Yrs,2.0,5.0,,,,Remote,365.0,Naukri,3.5,5.0,"Data Analyst, Business process, Analytical",
