623,Power BI Developer,Speridian Technologies Pvt Ltd,4-9 Yrs,4.0,9.0,,,,"Thiruvananthapuram, Mumbai, Cochin/Ernakulam/Kochi
													+1 more",240.0,Naukri,3.5,251.0,"SQL, SSIS, Debugging",
624,Data Analyst,CVM Solutions,1-2 Yrs,1.0,2.0,,,,Hyderabad / Secunderabad,365.0,Naukri,4.7,9.0,"Troubleshooting, SQL, Manager Quality Assurance",
625,Data Analyst,supplier.io,3-5 Yrs,3.0,5.0,₹ 5.55 - 6L/yr (AmbitionBox estimate),555000.0,600000.0,Hyderabad / Secunderabad,365.0,Naukri,4.7,9.0,"Troubleshooting, SQL, Manager Quality Assurance",Estimated by Ambition Box
626,Data Analyst,supplier.io,2-5 Yrs,2.0,5.0,,,,Hyderabad / Secunderabad,365.0,Naukri,4.7,9.0,"Troubleshooting, SQL, Manager Quality Assurance",
627,Data Support Analyst,CVM Solutions,3-5 Yrs,3.0,5.0,,,,Hyderabad / Secunderabad,365.0,Naukri,4.7,9.0,"Troubleshooting, Data analysis, SQL",
628,Data Analyst,CVM Solutions,2-4 Yrs,2.0,4.0,,,,Hyderabad / Secunderabad,365.0,Naukri,4.7,9.0,"Troubleshooting, SQL, Manager Quality Assurance",
629,Process Developer Data Analyst,Marktine,1-3 Yrs,1.0,3.0,,,,Remote,730.0,Naukri,4.7,62.0,"CRM, OTC, SMS",
630,Data Analyst(Tableau Developer),Marktine,3-8 Yrs,3.0,8.0,,,,Remote,730.0,Naukri,4.7,62.0,"IT services, SAN, Analytical",
631,Screen-Magic - Data Analyst - Founder's Office (4-10 yrs),Screen-Magic Mobile Media Private Limited,4-10 Yrs,4.0,10.0,,,,Pune,30.0,iimjobs,3.8,26.0,"Analytics, Data Analytics, Business Intelligence",
632,Aryng - Senior Data Analyst - Visualization Tools (4-8 yrs),Aryng LLC,4-8 Yrs,4.0,8.0,,,,Mumbai,20.0,hirist,4.4,3.0,"Data Analyst, Data Analytics, MySQL",
633,Medical Data Analyst Level I,ZignaAI,1-4 Yrs,1.0,4.0,,,,Hyderabad / Secunderabad,30.0,Naukri,4.8,4.0,"Healthcare, Billing, Analytical",
634,Operations Head,Genique Management,2-7 Yrs,2.0,7.0,,,,"Karnataka, Andhra Pradesh, Maharastra
													+2 more",30.0,Naukri,3.9,11.0,"Program Management, Operations Manager, Excel",
635,Business and Data Analyst,Accura Weldrods Kovai Pvt Ltd,1-3 Yrs,1.0,3.0,₹ 3 - 7L/yr,300000.0,700000.0,Coimbatore,1.0,Naukri,3.3,4.0,"Dax Queries, Power Bi Reports, Business Intelligence",Salary Listed by Company
636,"Product Data Analyst(ACES, PIES)",Fenyes Engineered Technology Pvt Ltd,4-6 Yrs,4.0,6.0,,,,Bangalore / Bengaluru,4.0,Naukri,3.7,3.0,"PIES, Data Management, Data Extraction",
637,Sr. Data Analyst,PureSpectrum,3-6 Yrs,3.0,6.0,,,,Hyderabad / Secunderabad,6.0,Naukri,3.3,5.0,"Health insurance, Data validation, Employee engagement",
638,Data Analyst,Kazam,1-3 Yrs,1.0,3.0,,,,Bangalore / Bengaluru,24.0,Naukri,3.3,15.0,"Computer science, Stakeholder Engagement, Coding",
639,Business Data Analyst,Netxcell Ltd,3-8 Yrs,3.0,8.0,,,,Vijayawada,365.0,Naukri,3.6,90.0,"Computer science, C, Business Data Analyst",
640,Data Analyst,Reubro International,4-6 Yrs,4.0,6.0,,,,Cochin/Ernakulam/Kochi,2555.0,Naukri,5.0,6.0,"documentation, data management, data mining",
641,Business Data Analyst,Netxcell Ltd,3-8 Yrs,3.0,8.0,,,,Vijayawada,365.0,Naukri,3.6,90.0,"Business Analyst, Business Data Analyst, Manager Technology",
642,Data Analyst,Reubro International,4-6 Yrs,4.0,6.0,,,,Cochin/Ernakulam/Kochi,2920.0,Naukri,5.0,6.0,"documentation, data management, data mining",
643,Data Analyst,Reubro International,4-6 Yrs,4.0,6.0,,,,"Cochin/Ernakulam/Kochi, Kochi",2920.0,Naukri,5.0,6.0,"documentation, data management, data mining",
644,Business Data Analyst,Netxcell Ltd,3-8 Yrs,3.0,8.0,,,,Vijayawada,365.0,Naukri,3.6,90.0,"Computer science, C, Business Data Analyst",
645,Data Analyst -M&T,Accolite Software India Pvt Ltd,5-7 Yrs,5.0,7.0,,,,Bangalore / Bengaluru,365.0,Naukri,3.4,593.0,"SQL, Analytical, MATLAB",
646,Data Analyst,Diya Systems (Mangalore) Pvt. Ltd.,4-9 Yrs,4.0,9.0,,,,Mangaluru,1095.0,Naukri,3.5,289.0,"SQL, Technical support, Application development",
647,HealthPlix - Data Analyst - Tableau/Power BI (1-5 yrs),HealthPlix Technologies Pvt Ltd,1-5 Yrs,1.0,5.0,,,,Bangalore / Bengaluru,60.0,hirist,3.3,127.0,"Tableau, MySQL, SQL",
648,PharmaScroll - Data Analyst (8-10 yrs),Pharmascroll,8-10 Yrs,8.0,10.0,,,,Bangalore / Bengaluru,26.0,hirist,3.8,7.0,"SQL, Data Analyst, Data Analytics",
649,TransOrg Analytics - Data Scientist - R/Python/SQL (3-6 yrs),TransOrg Analytics,3-6 Yrs,3.0,6.0,,,,"Delhi ncr, Mumbai, Bangalore / Bengaluru
													+1 more",19.0,hirist,2.8,28.0,"Data Scientist, Data Science, Python",
650,Revolo Infotech - Data Analyst (2-4 yrs),Revolo Infotech,,,,,,,,60.0,hirist,4.9,9.0,,
651,Data Analyst (2-4 yrs),Revolo Infotech,,,,,,,,60.0,hirist,4.9,9.0,,
652,Data Analyst Intern,Idatalytics,0-1 Yrs,0.0,1.0,,,,Cochin/Ernakulam/Kochi,30.0,Naukri,3.7,8.0,"Presentation Skills, Excel, Statistical Tools",
653,Global Marketing Data Analyst (3-5 yrs),e-Hireo global solutions,3-5 Yrs,3.0,5.0,,,,Bangalore / Bengaluru,12.0,iimjobs,3.2,8.0,"Analytics, Web Analytics, Data Analytics",
654,Lead Data Analyst - Economics,The Economist Newspaper Limited,3-7 Yrs,3.0,7.0,,,,Gurgaon / Gurugram,30.0,Naukri,4.0,15.0,"Data analysis, SQL, Manager Quality Assurance",
655,Data Analyst,PradeepIT,5-7 Yrs,5.0,7.0,,,,Bangalore / Bengaluru,90.0,Naukri,4.8,49.0,"SAP, Adobe, Automation",
656,Data Analyst,PradeepIT,1-3 Yrs,1.0,3.0,,,,Bangalore / Bengaluru,90.0,Naukri,4.8,49.0,"SAP, CRM, Troubleshooting",
657,Data Analyst,PradeepIT,5-7 Yrs,5.0,7.0,,,,Bangalore / Bengaluru,90.0,Naukri,4.8,49.0,"Data Analyst, Informatica, Data quality",
658,Data Analyst,PradeepIT,1-3 Yrs,1.0,3.0,,,,Bangalore / Bengaluru,90.0,Naukri,4.8,49.0,"SAP, Silicon, Adobe",
659,Data Analyst,Apollo Tele health Services,3-8 Yrs,3.0,8.0,,,,Hyderabad / Secunderabad,90.0,Naukri,3.8,110.0,"MySQL, Python, Data Analyst",
660,Network Engineer,Digital Vidya,4-7 Yrs,4.0,7.0,,,,Gurgaon / Gurugram,365.0,Naukri,4.2,20.0,"Networking, Troubleshooting, Data analysis",
661,Data Analyst,PradeepIT,1-3 Yrs,1.0,3.0,,,,Bangalore / Bengaluru,90.0,Naukri,4.8,49.0,"SAP, Silicon, Adobe",
662,Data Analyst,PradeepIT,5-7 Yrs,5.0,7.0,,,,Bangalore / Bengaluru,90.0,Naukri,4.8,49.0,"SAP, Adobe, Automation",
663,Data Analyst,PradeepIT,1-3 Yrs,1.0,3.0,,,,Bangalore / Bengaluru,90.0,Naukri,4.8,49.0,"SAP, CRM, Troubleshooting",
664,Data Analyst,PradeepIT,5-7 Yrs,5.0,7.0,,,,Bangalore / Bengaluru,90.0,Naukri,4.8,49.0,"Data Analyst, Informatica, Data quality",
665,Data Analyst,Incanus Technologies,1-6 Yrs,1.0,6.0,₹ 5 - 15L/yr,500000.0,1500000.0,"Pune, Delhi/Ncr, Bangalore / Bengaluru",27.0,Naukri,3.8,7.0,"Excel, Python, SQL",Salary Listed by Company
666,Nivoda - Marketing & Sales Data Analyst (6-9 yrs),Nivoda,6-9 Yrs,6.0,9.0,,,,Mumbai,30.0,iimjobs,3.9,16.0,"Analytics, Marketing Analytics, Sales Analytics",
667,Data Analyst,Northstar Pathology Lab,1-6 Yrs,1.0,6.0,,,,Ahmedabad,9.0,Naukri,3.5,4.0,Data Analyst,
668,MIS Manager ( Senior Data Analyst ),Quantum Asset Management Company Private Limited,7-9 Yrs,7.0,9.0,,,,Mumbai,120.0,Naukri,3.9,30.0,"MIS, SQL, Logistics",
669,Data Analyst,Albea,5-7 Yrs,5.0,7.0,,,,Panaji/Panjim,120.0,Naukri,3.7,19.0,"Pharma, Costing, Packaging",
670,Data Analyst,Albea,5-7 Yrs,5.0,7.0,,,,Panaji/Panjim,120.0,Naukri,3.7,19.0,"Pharma, Costing, Packaging",
671,Data Analyst - SAS/Python (4-9 yrs),HuQuo Consulting Pvt. Ltd.,4-9 Yrs,4.0,9.0,,,,"Delhi ncr, Gurgaon / Gurugram",30.0,hirist,3.8,14.0,"SAS, Python, Data Analyst",
672,Microstrategy Developer - Reporting Analytics & Dashboards (4-7 yrs),genxhire,4-7 Yrs,4.0,7.0,,,,Pune,30.0,hirist,3.5,51.0,"Microstrategy, Business Intelligence, Data Analyst",
673,Associate Data Analyst,SKIDOS,1-2 Yrs,1.0,2.0,,,,New Delhi,30.0,Naukri,3.9,14.0,"SQL, Python, Associate Data Analyst",
674,Data Analyst,VGMinds TechStudios Pvt Ltd,1-4 Yrs,1.0,4.0,,,,Bangalore / Bengaluru,25.0,Naukri,5.0,2.0,Data Analyst,
675,Data Analyst (2-15 yrs),Symbiosis Management Consultants Pvt Ltd,2-15 Yrs,2.0,15.0,,,,Mumbai,30.0,iimjobs,4.8,5.0,"Analytics, Data Analytics, Python",
676,Senior Data Analyst,VIACOM 18 MEDIA PRIVATE LIMITED,4-7 Yrs,4.0,7.0,,,,"Mumbai, Bangalore / Bengaluru",120.0,Naukri,3.7,74.0,"Statistical programming, Telecom, Bfsi",
677,Data Analyst II,VIACOM 18 MEDIA PRIVATE LIMITED,2-4 Yrs,2.0,4.0,,,,"Mumbai, Bangalore / Bengaluru",120.0,Naukri,3.7,74.0,"Statistical programming, Telecom, Bfsi",
678,Staff Data Analyst - JioCinema,VIACOM 18 MEDIA PRIVATE LIMITED,7-10 Yrs,7.0,10.0,,,,"Mumbai, Bangalore / Bengaluru",120.0,Naukri,3.7,74.0,"Telecom, Bfsi, Analytical",
679,Data Analyst- ML/Data Science,Intello Labs,2-4 Yrs,2.0,4.0,₹ 8 - 16L/yr,800000.0,1600000.0,Gurgaon/Gurugram,1460.0,bigshyft,3.7,91.0,"R, Hive, MATLAB",Salary Listed by Company
680,SAP Cloud Business Analyst / Tester / Data Analyst,Fort Technologies,2-5 Yrs,2.0,5.0,,,,"Chennai, Pune, New Delhi
													+4 more",5.0,Naukri,3.5,3.0,"System testing, Data analysis, SAP",
681,Junior Data Analyst,LumenData Solutions India Pvt Ltd,1-3 Yrs,1.0,3.0,,,,Bangalore / Bengaluru,30.0,Naukri,3.8,12.0,"Data analysis, SQL, Data processing",
682,Tableau Developer - Reporting Analytics (5-8 yrs),TIGI HR Solution Pvt. Ltd.,5-8 Yrs,5.0,8.0,,,,Bangalore / Bengaluru,60.0,hirist,4.1,18.0,"Tableau, Data Analytics, Data Analyst",
683,SQL Developer / Data Analyst - Fresher,Breakwalls Technologies,0-3 Yrs,0.0,3.0,,,,Bangalore / Bengaluru,4.0,Naukri,3.8,2.0,"SQL Server Development, Excel, Tsql Development",
684,Data Analyst,Circle K Stores Inc,2-5 Yrs,2.0,5.0,,,,Gurgaon / Gurugram,30.0,Naukri,4.0,22.0,"data engineering, data analysis, user stories",
685,Data Analyst,TechUp Labs,1-4 Yrs,1.0,4.0,,,,Remote,30.0,Naukri,4.0,12.0,"Python, Data modeling, Selenium",
686,Data Analyst,Capillary Technologies India Pvt. Ltd.,2-5 Yrs,2.0,5.0,,,,Bangalore / Bengaluru,90.0,Naukri,3.5,173.0,"SQL, Automation, Python",
687,Associate Data Analyst,"comScore, Inc.",2-7 Yrs,2.0,7.0,,,,Pune,120.0,Naukri,3.7,34.0,"metadata, Provident fund, Linux",
688,Data Analyst,Simplilearn Solutions,1-3 Yrs,1.0,3.0,₹ 4.2 - 10L/yr (AmbitionBox estimate),420000.0,1000000.0,Bangalore / Bengaluru,120.0,Naukri,3.2,612.0,"Project management, Analytics, Product engineering",Estimated by Ambition Box
689,Senior Data Analyst,Simplilearn Solutions,2-4 Yrs,2.0,4.0,,,,Bangalore / Bengaluru,120.0,Naukri,3.2,612.0,"Project management, Analytics, SQL",
690,BI Developer,Lighthouse Info Systems Pvt. Ltd.,1-3 Yrs,1.0,3.0,,,,Nagpur,730.0,Naukri,3.8,55.0,"Business intelligence, Analytics, data visualization",
691,Data Analyst,Capillary Technologies India Pvt. Ltd.,2-5 Yrs,2.0,5.0,,,,Bangalore / Bengaluru,90.0,Naukri,3.5,173.0,"SQL, Automation, Python",
692,Senior Data Analyst,Simplilearn Solutions,2-4 Yrs,2.0,4.0,,,,Bangalore / Bengaluru,120.0,Naukri,3.2,612.0,"Project management, Analytics, SQL",
693,Sr. Data Analyst,XenonStack Private Ltd,3-4 Yrs,3.0,4.0,,,,Mohali,300.0,Naukri,3.6,178.0,"Analytical, Consulting, SQL",
694,Reference Data Analyst,ICE DATA SERVICES INDIA PRIVATE LIMITED,0-2 Yrs,0.0,2.0,,,,Hyderabad/Secunderabad,240.0,First Naukri,3.2,100.0,"Excel, VBA, MS Office",
695,Frontend Developer,Heart It Out,1-3 Yrs,1.0,3.0,,,,Remote,300.0,Naukri,4.6,66.0,"Internship, Data Analyst",
696,Data Analyst,Fabzen Technologies Pvt. Ltd.,3-8 Yrs,3.0,8.0,,,,Pune,365.0,Naukri,4.6,69.0,"Analytical skills, tableau, Machine learning",
697,Data Analyst,DecisionTree Analytics and Services Private Limited,1-3 Yrs,1.0,3.0,,,,Gurgaon / Gurugram,1460.0,Naukri,4.2,17.0,"SQL, Data warehousing, Data Analyst",
698,Data Analyst,DecisionTree Analytics and Services Private Limited,1-3 Yrs,1.0,3.0,,,,Gurgaon / Gurugram,1460.0,Naukri,4.2,17.0,"PHP, MySQL, Informatica",
699,Data Analyst,Heart It Out,1-3 Yrs,1.0,3.0,,,,Remote,300.0,Naukri,4.6,66.0,"Internship, Data Analyst, MySQL",
700,Human Resources Data Analyst II,Mold-Masters Limited,2-4 Yrs,2.0,4.0,,,,Coimbatore,60.0,Naukri,3.8,39.0,"Analytics, Automation, Continuous improvement",
701,Technical Consultant,Andor Tech (India) Pvt Ltd,5-10 Yrs,5.0,10.0,,,,Bangalore / Bengaluru,150.0,Naukri,3.8,44.0,"Automation, Python, Agile",
702,Data Analyst,Andor Tech (India) Pvt Ltd,5-9 Yrs,5.0,9.0,,,,Bangalore / Bengaluru,270.0,Naukri,3.8,44.0,"SQL, Agile, Software design",
703,Business Analyst - Entry-Ops,Andor Tech (India) Pvt Ltd,4-8 Yrs,4.0,8.0,,,,Bangalore / Bengaluru,270.0,Naukri,3.8,44.0,"Data analysis, SQL, Adobe",
704,Data Analyst,SourceFuse Technologies (India) Pvt Ltd.,6-11 Yrs,6.0,11.0,,,,Remote,120.0,Naukri,3.6,92.0,"IT services, Computer science, Data analysis",
705,Senior Data Analyst,Robosoft Technologies Pvt. Ltd,3-6 Yrs,3.0,6.0,,,,"Mumbai, Udupi, Bangalore / Bengaluru",150.0,Naukri,3.4,246.0,"Computer science, Business analysis, Information security",
706,Data Analyst,Mobikwik,3-5 Yrs,3.0,5.0,₹ 3 - 8L/yr (AmbitionBox estimate),300000.0,800000.0,Gurgaon/Gurugram,1095.0,bigshyft,3.4,255.0,"SQL, Hive, Tableau",Estimated by Ambition Box
707,Senior Data Analyst - Boutique Strategy Research Firm (2-4 yrs),Unnati,2-4 Yrs,2.0,4.0,,,,New Delhi,60.0,iimjobs,4.1,74.0,"Data Analytics, Analytics, Statistics",
708,Data Analyst - Hadoop/Big Data Platform (9-12 yrs),TD NEWTON,9-12 Yrs,9.0,12.0,,,,Mumbai,30.0,hirist,2.7,33.0,"Data Analyst, Data Analytics, Data Profiling",
709,Network Engineer,Essenware Private Limted,2-4 Yrs,2.0,4.0,,,,"Chennai, Pune, New Delhi
													+4 more",30.0,Naukri,4.7,4.0,"Data analysis, Automation, Analytical",
710,Data Analyst,Kishore Tech Solutions Overseas Pvt Ltd,1-4 Yrs,1.0,4.0,,,,Bangalore / Bengaluru,60.0,Naukri,5.0,6.0,"Analyst, Analytical, Programming",
711,Data Analyst - Web Analytics (4-7 yrs),Hitya Global,4-7 Yrs,4.0,7.0,,,,Navi Mumbai,7.0,hirist,5.0,1.0,"Data Analyst, Data Analytics, Google Analytics",
712,Data Analyst - IT (4-10 yrs),Resource Tree Global Services,4-10 Yrs,4.0,10.0,,,,"Mumbai, Bangalore / Bengaluru, Hyderabad / Secunderabad
													+3 more",7.0,iimjobs,5.0,1.0,"Data Analytics, Analytics, Data Visualization",
713,Power BI Lead - Data Analytics (7-9 yrs),Nice Software Solutions Pvt. Ltd,7-9 Yrs,7.0,9.0,,,,Bangalore / Bengaluru,60.0,hirist,3.5,59.0,"Power BI, Data Analytics, BI Reporting",
714,Data Analyst,Genxlead Solutions Pvt Ltd,1-4 Yrs,1.0,4.0,,,,Chennai,120.0,Naukri,3.9,32.0,"Data analysis, Machine learning, Email marketing",
715,DecisionTree - Power BI Developer - ETL Tools (5-8 yrs),Decision Tree Analytics,5-8 Yrs,5.0,8.0,,,,Gurgaon / Gurugram,30.0,hirist,4.4,7.0,"BI/DW, Power BI, DAX Power BI",
716,Machine Learning Data Analyst,Adventure India Journey Private Ltd.,5-10 Yrs,5.0,10.0,,,,New Delhi,20.0,Naukri,4.5,2.0,"Exploratory Data Analysis, Artificial Intelligence, Natural Language Processing",
717,Data Analyst,Aryng,1-3 Yrs,1.0,3.0,,,,Gurgaon / Gurugram,30.0,Naukri,4.4,3.0,"data analytics, data analysis, data science",
718,Data Analyst,Aryng,1-3 Yrs,1.0,3.0,,,,Chennai,30.0,Naukri,4.4,3.0,"python, ux, data analytics",
719,Data Analyst,Aryng,4-7 Yrs,4.0,7.0,,,,New Delhi,30.0,Naukri,4.4,3.0,"Hypothesis testing, cloud, Presto",
720,AM/Manager- Financial Data Analyst,DMI FINANCE PRIVATE LIMITED,3-4 Yrs,3.0,4.0,₹ 6 - 6.05L/yr (AmbitionBox estimate),600000.0,605000.0,New Delhi,120.0,Naukri,3.6,71.0,"MIS, Fund raising, Financial statements",Estimated by Ambition Box
721,Engineer - Data Analyst,BUSINESSNEXT,1-3 Yrs,1.0,3.0,,,,Mumbai,150.0,Naukri,3.3,346.0,"Data Analyst, Data migration, Machine learning",
722,Data Analyst,Lobotus Technology Private Limited,3-5 Yrs,3.0,5.0,,,,Bangalore / Bengaluru,2190.0,Naukri,4.0,17.0,"Data processing, VLOOKUP, Internet surfing",
723,Associate - Web Developer and Data Analyst,iForest,5-8 Yrs,5.0,8.0,,,,Noida,9.0,Naukri,3.2,4.0,"python, css, data analysis",
724,Data Analyst - SQL/Python (4-20 yrs),td newton and associates,4-20 Yrs,4.0,20.0,,,,Pune,30.0,hirist,2.7,33.0,"Data Analyst, Data Analytics, SQL",
725,Data Analyst - SQL/Tableau (3-5 yrs),Cortex Consulting Pvt. Ltd.,3-5 Yrs,3.0,5.0,,,,Bangalore / Bengaluru,60.0,hirist,3.1,16.0,"Data Analyst, Data Analytics, SQL",
726,Data Analyst,Aryng,1-3 Yrs,1.0,3.0,,,,Bangalore / Bengaluru,30.0,Naukri,4.4,3.0,"data analysis, data science, Data management",
727,Data Analyst,Aryng,4-9 Yrs,4.0,9.0,,,,Mumbai,30.0,Naukri,4.4,3.0,"Presto, A/B Testing, hypothesis testing",
728,Data Analyst,Aryng,1-3 Yrs,1.0,3.0,,,,Hyderabad / Secunderabad,30.0,Naukri,4.4,3.0,"ux, data analytics, data analysis",
729,Data Analyst,"Cloudflare, Inc.",5-9 Yrs,5.0,9.0,,,,Remote,4.0,Naukri,,,"Customer management, Manager Quality Assurance, Networking",
730,Lead Consultant - Digital Transformation (15-20 yrs),Job Seeks 4U Consultancy Services,15-20 Yrs,15.0,20.0,,,,Bangalore / Bengaluru,21.0,hirist,3.4,5.0,"Data Analytics, Data Analyst, Python",
731,LenDenClub - Team Lead - Analytics & Data Science (5-10 yrs),LenDenClub,5-10 Yrs,5.0,10.0,,,,Mumbai,60.0,hirist,3.2,69.0,"Data Analyst, Data Analytics, Data Science",
732,Data Analyst,Comscore Technologies,2-4 Yrs,2.0,4.0,,,,Pune,24.0,Naukri,4.6,2.0,"SAS, Database Queries, SQL Queries",
733,Commercial Analyst / Data Analyst,Printo Document Services Pvt. Ltd,1-4 Yrs,1.0,4.0,,,,"Chennai, Pune, New Delhi
													+4 more",240.0,Naukri,3.5,93.0,"Logistics, Data analysis, Commercial Analyst",
734,Data Analyst - Imaginarium,Imaginarium India Pvt Ltd,2-5 Yrs,2.0,5.0,₹ 6 - 10L/yr (AmbitionBox estimate),600000.0,1000000.0,Mumbai,365.0,Naukri,3.7,34.0,"Data analysis, Interpersonal skills, Investor relations",Estimated by Ambition Box
735,Osfin.ai - Data Analyst (2-6 yrs),Osfin.ai,2-6 Yrs,2.0,6.0,,,,Bangalore / Bengaluru,30.0,iimjobs,3.8,5.0,"Analytics, Data Analytics, SQL",
736,Sr. Data Analyst,Jio Tesseract,4-6 Yrs,4.0,6.0,,,,"Navi Mumbai, Mumbai",5.0,Naukri,1.7,57.0,"Data analysis, Data management, Analytical",
737,Data Analyst - R/Python (5-7 yrs),Quantumbricks,,,,,,,,12.0,hirist,5.0,1.0,,
738,SpectraMedix - BI Analyst - Tableau (3-8 yrs),SpectraMedix India,3-8 Yrs,3.0,8.0,,,,Delhi ncr,90.0,hirist,3.8,23.0,"Tableau, Business Analyst, Data Analyst",
739,Data Analyst,Avaali Solutions Pvt Ltd,2-7 Yrs,2.0,7.0,,,,Bangalore / Bengaluru,210.0,Naukri,3.7,33.0,"Analytics, SQL, Consulting",
740,Site Data Analyst,Apraava Energy,4-7 Yrs,4.0,7.0,,,,"Vadodara, Ahmedabad, Rajkot
													+2 more",330.0,Naukri,4.5,41.0,"Auditing, SCM, Monitoring",
741,Data Mapping,NISC Exports Services (p) Ltd,2-6 Yrs,2.0,6.0,,,,Hyderabad / Secunderabad,365.0,Naukri,3.5,62.0,"Manager Quality Control, XML, Publishing",
742,NewsBytes - Data Analyst - Big Data/Machine Learning (1-3 yrs),NewsBytes,,,,,,,,10.0,hirist,2.4,11.0,,
743,Business Data Analyst (6-8 yrs),Yo HR Consultancy,6-8 Yrs,6.0,8.0,,,,Bangalore / Bengaluru,13.0,hirist,5.0,1.0,"Business System Analyst, Business Analyst, Data Analyst",
744,"Data Analyst, II",Antuit Inc.,2-5 Yrs,2.0,5.0,,,,Bangalore / Bengaluru,30.0,Naukri,2.2,13.0,"Analytical, Customer service, SQL",
745,Employee Data Analyst,Tableau Software,4-6 Yrs,4.0,6.0,,,,Hyderabad / Secunderabad,9.0,Naukri,1.1,2.0,"global operations, Root cause analysis, human capital",
746,Data Analyst,Globalme Localization,2-7 Yrs,2.0,7.0,,,,Remote,365.0,Naukri,3.7,26.0,"Data Analyst, Data analysis, SQL",
747,Sr. Data Analyst,Weather Risk Management Services Ltd,1-4 Yrs,1.0,4.0,,,,Gurgaon / Gurugram,365.0,Naukri,3.4,75.0,"Automation, Data validation, Analytical",
748,Senior Data Analyst,Jupiter,3-6 Yrs,3.0,6.0,₹ 11 - 22.5L/yr,1100000.0,2250000.0,Bengaluru/Bangalore,19710.0,bigshyft,3.4,67.0,"SQL, Python, Tableau",Salary Listed by Company
749,Senior Manager - Renewals Data Analyst - Life Insurance (9-10 yrs),TalenSys,,,,,,,,14.0,iimjobs,5.0,1.0,,
750,Marketing Data Analyst,Marrina decisions,2-5 Yrs,2.0,5.0,,,,Remote,26.0,Naukri,4.0,3.0,"Data analysis, Project management, Process improvement",
751,Data Analyst,Akhil Systems,3-5 Yrs,3.0,5.0,,,,Gurgaon / Gurugram,120.0,Naukri,3.6,24.0,"SQL, Python, Business intelligence",
752,Data Analyst,CAMSDATA Technologies India Pvt Ltd,2-8 Yrs,2.0,8.0,,,,Bangalore / Bengaluru,365.0,Naukri,3.5,45.0,"SQL, Python, MIS",
753,Internal Audit Data Analyst,Stripe,5-7 Yrs,5.0,7.0,,,,Bangalore / Bengaluru,90.0,Naukri,3.6,18.0,"Analytics, SQL, Auditing",
754,Data Analyst - Operations,Apna Recruiter,1-2 Yrs,1.0,2.0,₹ 13 - 10L/yr (AmbitionBox estimate),1300000.0,1000000.0,Bangalore / Bengaluru,150.0,Naukri,3.2,145.0,"CRM, Data analysis, SQL",Estimated by Ambition Box
755,Senior Data Analytics Engineer - Hadoop/Scala (3-5 yrs),QAAgility Technologies,3-5 Yrs,3.0,5.0,,,,Pune,60.0,hirist,3.8,5.0,"Data Analytics, Data Analyst, Data Infrastructure",
756,Data Analyst,NOVISYNC SOLUTIONS INDIA PRIVATE LIMITED,3-4 Yrs,3.0,4.0,,,,Visakhapatnam,30.0,Naukri,4.7,4.0,"Data Analyst, Customer service, Backend",
757,Data Analysis Consultant (2-7 yrs),ANAKIN SKYWALKER PRIVATE LIMITED,2-7 Yrs,2.0,7.0,,,,Bangalore / Bengaluru,12.0,hirist,2.5,10.0,"Data Analyst, Data Analytics, Business Analyst",
758,Data Analyst,MIndstix Software Labs Pvt,3-8 Yrs,3.0,8.0,,,,Pune,90.0,Naukri,3.4,63.0,"SQL, SAN, Data structures",
759,Data Analyst,"KPI Partners, Inc.",5-10 Yrs,5.0,10.0,,,,"Chennai, Pune, New Delhi
													+4 more",300.0,Naukri,3.3,103.0,"Analytical skills, Data analysis, Excel",
760,Data Analyst,Antarctica Global,1-4 Yrs,1.0,4.0,,,,Mumbai,180.0,Naukri,4.4,24.0,"Analytical, Windows, Data analysis",
761,Data Analyst,"KPI Partners, Inc.",5-10 Yrs,5.0,10.0,,,,"Chennai, Pune, New Delhi
													+4 more",300.0,Naukri,3.3,103.0,"Analytical skills, Data analysis, Excel",
762,Senior Data Analyst,Tata nexarc,3-6 Yrs,3.0,6.0,,,,"Mumbai, Bangalore / Bengaluru",365.0,Naukri,3.1,210.0,"Analytical, OLAP, Manager Quality Control",
763,Data Analyst,Innovation Incubator Advisory Pvt. Ltd.,1-2 Yrs,1.0,2.0,,,,Remote,365.0,Naukri,4.1,10.0,"Data modeling, Data Analyst, Statistics",
764,Data Governance Analyst - Informatica (3-6 yrs),Info Origin Inc,3-6 Yrs,3.0,6.0,,,,Bangalore / Bengaluru,60.0,hirist,4.2,11.0,"Data Governance, Data Analyst, Informatica",
765,Data Analyst,Scalelot Technologies,2-7 Yrs,2.0,7.0,,,,Surat,30.0,Naukri,3.6,5.0,Data Analyst,
766,Data Analyst,Samhita Integrated Solutions,2-4 Yrs,2.0,4.0,,,,"New Delhi, Mumbai",60.0,Naukri,4.1,15.0,"Troubleshooting, Data analysis, SQL",
767,Sales Data Analyst,T7E Aftermarket Connect Pvt. Ltd.,3-8 Yrs,3.0,8.0,,,,Mumbai,60.0,Naukri,4.1,48.0,"Data Analyst, Sales operations, MS Access",
768,BI Data Analyst,Saltmine,2-4 Yrs,2.0,4.0,,,,Bangalore / Bengaluru,30.0,Naukri,4.7,3.0,"Data Analyst, SQL, Business intelligence",
769,Lead - Data Analyst and Research Team,AppZen,2-5 Yrs,2.0,5.0,₹ 3.5 - 4L/yr (AmbitionBox estimate),350000.0,400000.0,Pune,120.0,Naukri,3.9,14.0,"Analytical, Data quality, lead data analyst",Estimated by Ambition Box
770,Data Analyst,Tekfriday Processing Solutions Pvt Ltd.,0-2 Yrs,0.0,2.0,,,,Hyderabad/Secunderabad,365.0,First Naukri,4.0,79.0,"MySQL, Data Analysis, Data Visualization",
771,Lead - Data Analyst and Research Team,AppZen,2-5 Yrs,2.0,5.0,₹ 3.5 - 4L/yr (AmbitionBox estimate),350000.0,400000.0,Pune,120.0,Naukri,3.9,14.0,"Analytical, Data quality, lead data analyst",Estimated by Ambition Box
772,Python Developer - Artificial Intelligence (2-4 yrs),Crossover,2-4 Yrs,2.0,4.0,,,,"Mumbai, Jaipur, Rajasthan",30.0,hirist,3.3,26.0,"Python, Data Science, Data Analyst",
773,Data Analyst II,REED ELSEVIER INDIA (a part of RELX India Pvt Ltd),3-6 Yrs,3.0,6.0,,,,Bangalore / Bengaluru,60.0,Naukri,3.7,91.0,"Analytics, Data analysis, Healthcare",
774,Sales Operations Data Analyst,"Cloudflare, Inc.",0-4 Yrs,0.0,4.0,,,,Remote,13.0,Naukri,,,"Data analysis, Operational excellence, Data management",
775,Data Analyst - Tableau/Power BI (2-5 yrs),T D Newton,2-5 Yrs,2.0,5.0,,,,"Hyderabad / Secunderabad, Gujarat, Chandigarh
													+5 more",30.0,hirist,2.7,33.0,"Data Visualization, Power BI, Tableau",
776,VDOT Data Analyst 2,Hankersystems India,0-1 Yrs,0.0,1.0,,,,Richmond,16.0,Naukri,3.3,3.0,"adhoc analysis, Data analysis, Power BI",
777,Senior Data Analyst,Deliveroo,3-6 Yrs,3.0,6.0,,,,"Chennai, Pune, New Delhi
													+4 more",30.0,Naukri,3.3,18.0,"Healthcare, SQL, Analytical",
778,E - commerce Data Analyst,Shine Business Solutions,2-7 Yrs,2.0,7.0,,,,Cochin/Ernakulam/Kochi,270.0,Naukri,3.9,11.0,"Data Analyst, Python, Consulting",
779,Sr Data Analyst / Power BI Developer,smartSense Consulting Solutions,2-4 Yrs,2.0,4.0,,,,Gandhinagar,730.0,Naukri,4.4,6.0,"Data Warehousing, Sql, Business Intelligence",
780,Data Analyst,BTree Systems,5-10 Yrs,5.0,10.0,,,,Chennai,240.0,Naukri,4.9,9.0,"IT training, Data Analyst, Training",
781,E - commerce Data Analyst,Shine Business Solutions,2-7 Yrs,2.0,7.0,,,,Cochin/Ernakulam/Kochi,270.0,Naukri,3.9,11.0,"Data Analyst, Python, Consulting",
782,Data Analyst,SSPL,2-7 Yrs,2.0,7.0,,,,"New Delhi, Mumbai",365.0,Naukri,4.0,72.0,"SQL, Cognos, ERP",
783,Data analyst,Purpos Planet,1-5 Yrs,1.0,5.0,,,,New Delhi,365.0,Naukri,4.6,13.0,"MIS, FMCG, Sales analysis",
784,Data Analyst,"CityInfo Services Pvt. Ltd.,",15-18 Yrs,15.0,18.0,,,,Bangalore / Bengaluru,730.0,Naukri,4.3,26.0,"Excel, Analytical, Consulting",
785,Sr Data Analyst / Power BI Developer,smartSense Consulting Solutions,2-4 Yrs,2.0,4.0,,,,Gandhinagar,730.0,Naukri,4.4,6.0,"Data Warehousing, Sql, Business Intelligence",
786,Netradyne - Staff Data Analyst - Machine Learning (5-8 yrs),Netradyne Technologies India Pvt Ltd,5-8 Yrs,5.0,8.0,,,,Bangalore / Bengaluru,60.0,hirist,3.6,37.0,"Data Analyst, Machine Learning, SQL",
787,Sales Data Analyst,British Safety Council,3-5 Yrs,3.0,5.0,,,,Mumbai,17.0,Naukri,2.9,5.0,"Data Visualization, Advanced Excel, Reporting And Analytics",
788,Data Analyst - SQL/Python (6-10 yrs),Forward eye technologies,6-10 Yrs,6.0,10.0,,,,"Chennai, Noida",30.0,hirist,4.7,3.0,"Data Analyst, Data Analytics, Snowflake DB",
789,Data Analyst - Customer Experience,Flutter International,1-4 Yrs,1.0,4.0,,,,Gurgaon / Gurugram,10.0,Naukri,4.0,1.0,"Operations Analyst, Senior Executive, Data Analyst",
