302,Data Analyst,Ebizon Net Info Pvt Ltd,1-2 Yrs,1.0,2.0,,,,Dehradun,16.0,Naukri,3.3,59.0,"Mining, Computer science, Data validation",
303,Senior Data Analyst (Economics),Fibre2Fashion Pvt. Ltd.,4-5 Yrs,4.0,5.0,,,,"Thane, Mumbai",10.0,Naukri,4.1,46.0,"arima, python, project management",
304,Data Analyst Trainer/ Instructor,Internship Studio,2-4 Yrs,2.0,4.0,₹ 4 - 7L/yr,400000.0,700000.0,Pune,13.0,Naukri,4.3,27.0,"R, Azure, MS Excel",Salary Listed by Company
305,Data Security Analyst (4-10 yrs),IT,4-10 Yrs,4.0,10.0,,,,Bangalore / Bengaluru,30.0,hirist,3.5,4000.0,"Data Security, Data Analyst, On-Premises",
306,Target Corporation - Senior Data Analyst - Tableau (5-10 yrs),Target,5-10 Yrs,5.0,10.0,,,,Bangalore / Bengaluru,60.0,hirist,4.2,579.0,"Data Analyst, Data Analytics, Tableau",
307,Data Analyst,Ericsson India Global Services Pvt. Ltd.,4-12 Yrs,4.0,12.0,,,,Noida,150.0,Naukri,4.2,6500.0,"Business intelligence, Data mining, Trend analysis",
308,Data Analyst,Ericsson India Global Services Pvt. Ltd.,4-12 Yrs,4.0,12.0,,,,Patiala,150.0,Naukri,4.2,6500.0,"Data mining, Machine learning, PLSQL",
309,Senior Data Analyst (3-7 yrs),Zyoin,3-7 Yrs,3.0,7.0,,,,Bangalore / Bengaluru,30.0,iimjobs,4.0,287.0,"Data Analytics, Data Warehousing, SQL",
310,Sr Data Analyst,Space Multimedia,7-12 Yrs,7.0,12.0,₹ 20 - 25L/yr,2000000.0,2500000.0,Hyderabad / Secunderabad,11.0,Naukri,4.5,11.0,"Master & Meta Data Management and Governance, Data Wrangling, Unification",Salary Listed by Company
311,Data Analyst,Antino Labs,2-4 Yrs,2.0,4.0,,,,Gurgaon / Gurugram,25.0,Naukri,3.4,109.0,"Data Analysis, Data Reporting, Python",
312,LCM Restructuring Data Analyst,ION,2-4 Yrs,2.0,4.0,,,,"Navi Mumbai, Mumbai, Mumbai",4.0,Naukri,3.6,132.0,"Automation, Finance, Analysis",
313,Data Science Analyst - SQL/Python (3-18 yrs),Aricent,3-18 Yrs,3.0,18.0,,,,"Mumbai, Bangalore / Bengaluru, Hyderabad / Secunderabad
													+2 more",9.0,hirist,3.6,2000.0,"Data Science, Data Analyst, SQL",
314,ESG Data Analyst - Newsroom,Institutional Shareholder Services Inc.,2-6 Yrs,2.0,6.0,,,,Mumbai,30.0,Naukri,3.8,84.0,"Data Analyst, Business analytics, Manager Quality Assurance",
315,Data Analyst 3,Zynga Inc.,7-12 Yrs,7.0,12.0,,,,Bangalore / Bengaluru,30.0,Naukri,4.4,28.0,"SQL, Python, SAN",
316,Octro - Data Analyst (3-6 yrs),Octro,3-6 Yrs,3.0,6.0,,,,Noida,10.0,iimjobs,3.8,60.0,"Data Analytics, Analytics, SQL",
317,Senior Systems Engineer II,REED ELSEVIER INDIA (a part of RELX India Pvt Ltd),4-7 Yrs,4.0,7.0,,,,Bangalore / Bengaluru,4.0,Naukri,3.7,91.0,"Health insurance, Publishing, Analytical",
318,Principal Data Analyst - Reference Data,REED ELSEVIER INDIA (a part of RELX India Pvt Ltd),4-9 Yrs,4.0,9.0,,,,Chennai,4.0,Naukri,3.7,91.0,"automation framework, Maven, Test scripts",
319,Data Analyst,Pepipost,2-3 Yrs,2.0,3.0,,,,Bangalore / Bengaluru,30.0,Naukri,4.2,183.0,"SQL, Python, Data entry",
320,Senior Business Analyst - R/SQL/Python (5-8 yrs),Spectrum Consulting,5-8 Yrs,5.0,8.0,,,,Chennai,24.0,hirist,3.3,143.0,"Business Analyst, Data Analyst, SQL",
321,Data Analyst,Nits solutions Pvt Ltd,1-3 Yrs,1.0,3.0,₹ 4 - 8.32L/yr (AmbitionBox estimate),400000.0,832000.0,Gurgaon / Gurugram,18.0,Naukri,3.3,47.0,"Process design, Sales, Linguistics",Estimated by Ambition Box
322,Data Product Manager,Photon Infotech P Ltd,6-10 Yrs,6.0,10.0,,,,Chennai,30.0,Naukri,4.0,1400.0,"SQL, Python, Agile",
323,Data Analyst,RISKONNECT SERVICES,1-6 Yrs,1.0,6.0,,,,Remote,9.0,Naukri,4.5,12.0,"Computer science, Automation, Manager Quality Assurance",
324,Data Analyst,Rigved Technologies,3-7 Yrs,3.0,7.0,,,,"Mumbai suburbs, Mumbai",17.0,Naukri,3.2,54.0,"Excel, Power Bi, MIS",
325,Data Analyst,Affine Analytics,6-11 Yrs,6.0,11.0,,,,Bangalore Rural,26.0,Naukri,3.3,136.0,"excel, Ad-hoc and Insights, Power Bi",
326,Senior BI Data Analyst - Oracle Analytics Cloud (5-8 yrs),IT Resource Hunter,,,,,,,,30.0,hirist,4.3,29.0,,
327,Data Analyst,GoComet,1-3 Yrs,1.0,3.0,,,,"New Delhi, Gurgaon / Gurugram",24.0,Naukri,4.4,41.0,"Data analysis, Data validation, Business analysis",
328,IBS Business Data Analyst,Mondel z International,1-5 Yrs,1.0,5.0,,,,Mumbai,120.0,Naukri,4.4,895.0,"Supply chain, Data analysis, Data management",
329,Media Scan,Designboxed,2-4 Yrs,2.0,4.0,,,,Pune,11.0,Naukri,2.9,57.0,"Trend Identification, Crisis Management, Collaboration",
330,Hiring Kuwait-DATA Analyst/Surveyor/Darftsman,Ingenious Overseas Consultancy,5-7 Yrs,5.0,7.0,,,,Kuwait,5.0,Naukri,4.8,6.0,"Computer skills, geotechnics, rtk",
331,Power BI Developer - Data Modeling (5-10 yrs),Mobile Programming llc,,,,,,,,19.0,hirist,2.9,333.0,,
332,Data Analyst,Nits Solutions,2-7 Yrs,2.0,7.0,,,,Delhi/Ncr,20.0,Naukri,3.3,47.0,"Data Analysis, Data Analyst, Data Analytics",
333,Senior Data Analyst (3-6 yrs),Zyoin,3-6 Yrs,3.0,6.0,,,,Bangalore / Bengaluru,30.0,iimjobs,4.0,287.0,"Analytics, Data Analytics, SAS",
334,"Team Leader - Data Analyst || Credgenics(Python,SQL )",Credgenics,2-7 Yrs,2.0,7.0,,,,"Delhi/Ncr, New Delhi, Noida",7.0,Naukri,3.7,79.0,"SQL Queries, Data Extraction, Python",
335,Data Analyst - Tableau (7-12 yrs),Experis IT Private Limited,7-12 Yrs,7.0,12.0,,,,Bangalore / Bengaluru,30.0,hirist,3.1,523.0,"Data Analyst, Tableau, SQL",
336,Gallagher - Senior Analyst - Business Intelligence (4-10 yrs),Gallaghar,4-10 Yrs,4.0,10.0,,,,Bangalore / Bengaluru,60.0,hirist,3.9,1600.0,"R, Python, Business Intelligence",
337,Web Researcher,Cct Digisol,0-1 Yrs,0.0,1.0,,,,Ahmedabad,3.0,Naukri,3.8,33.0,"Information Research, Data Research, Web Research",
338,Data Analyst,Nimbus Pipes Ltd,2-3 Yrs,2.0,3.0,,,,Jaipur,12.0,Naukri,4.4,14.0,"Analytical skills, Data analysis, Data management",
339,Senior Data Analyst,Tarento Technologies Pvt Ltd,6-11 Yrs,6.0,11.0,,,,Bangalore / Bengaluru,30.0,Naukri,4.0,96.0,"power bi, powerapps, analysis",
340,Senior Data Analyst - R/SQL/Python (3-6 yrs),Zyoin,3-6 Yrs,3.0,6.0,,,,Bangalore / Bengaluru,30.0,hirist,4.0,287.0,"Data Analyst, Data Analytics, Statistical Modeling",
341,Data Analyst - Hadoop/Hive (4-5 yrs),Protiviti India Member Private limited,4-5 Yrs,4.0,5.0,,,,Bangalore / Bengaluru,30.0,hirist,3.3,242.0,"Data Analyst, Data Analytics, Analytics",
342,Data Analyst - B2C (3-6 yrs),Zyoin Web Pvt Ltd,3-6 Yrs,3.0,6.0,,,,Bangalore / Bengaluru,30.0,iimjobs,4.0,287.0,"Data Analytics, Analytics, Statistics",
343,Human Resources Data Analyst II,Coperion Ideal Pvt. Ltd.,2-4 Yrs,2.0,4.0,,,,Coimbatore,20.0,Naukri,3.1,41.0,"Computer science, Automation, Business Data Analyst",
344,Data Analyst,Bottle Lab Technologies Pvt. Ltd (SmartQ),0-1 Yrs,0.0,1.0,,,,Bangalore / Bengaluru,30.0,Naukri,4.0,82.0,"Market research, SQL, Data analysis",
345,IQVIA  - Data Analyst (0-1 yrs),IQVIA,0-1 Yrs,0.0,1.0,,,,Pune,60.0,iimjobs,4.0,3600.0,"Data Visualization, Tableau, Data Analytics",
346,Data Analyst,NEXTWAVE MULTIMEDIA (P) LTD.,2-7 Yrs,2.0,7.0,,,,Chennai,3.0,Naukri,4.0,16.0,"Analytical skills, hive, Data analysis",
347,Data Analyst / Business Intelligence,Monrow Shoes,2-4 Yrs,2.0,4.0,,,,Bangalore / Bengaluru,9.0,Naukri,4.7,7.0,"Data Analyst, Business intelligence",
348,Urgent Hiring Data  Analyst   Night Shift (7PM- 4AM)Noida 63,Emonics,4-9 Yrs,4.0,9.0,,,,Noida,20.0,Naukri,3.9,88.0,"Advanced Analytics, Pandas, Data Analysis",
349,Data Analyst - Marketing,NEC SOFTWARE SOLUTIONS (INDIA) PRIVATE LIMITED,5-8 Yrs,5.0,8.0,,,,Mumbai,23.0,Naukri,3.9,134.0,"R, BI, Data Analysis",
350,Data Analyst,Wellthy Therapeutics Pvt Ltd.,1-3 Yrs,1.0,3.0,,,,Remote,30.0,Naukri,3.8,43.0,"Analytics, Data analysis, SQL",
351,Data Analyst,Capillary Technologies India Pvt. Ltd.,2-5 Yrs,2.0,5.0,,,,Bangalore / Bengaluru,30.0,Naukri,3.5,173.0,"Automation, Python, Data analysis",
352,Data Analyst ( Hindi),Refex Group,0-1 Yrs,0.0,1.0,,,,Chennai,11.0,Naukri,4.4,11.0,"ERP, Data Analyst, data review",
353,NITS Solutions - Data Analyst - R/Python/SQL (2-4 yrs),NITS Solutions,2-4 Yrs,2.0,4.0,,,,Gurgaon / Gurugram,25.0,hirist,3.3,47.0,"Data Analyst, SQL, Python",
354,EMOB Data Analyst,VOLVO ASSET FINANCE INDIA PRIVATE LIMITED,1-4 Yrs,1.0,4.0,,,,Bangalore / Bengaluru,10.0,Naukri,4.0,20.0,"Usage, Focus, Construction equipment",
355,Hiring Data Analyst,Ericson Insurance TPA,3-8 Yrs,3.0,8.0,₹ 4 - 5L/yr,400000.0,500000.0,Mumbai,13.0,Naukri,3.8,58.0,"excel, python, advanced excel",Salary Listed by Company
356,Data Analyst - Senior,M/s. orange business services,2-6 Yrs,2.0,6.0,,,,Gurgaon / Gurugram,90.0,Naukri,4.3,1200.0,"Computer science, Automation, Business analytics",
357,Data Analyst Trainer,Btree Systems (opc),0-1 Yrs,0.0,1.0,₹ 1.5 - 2.5L/yr,150000.0,250000.0,Chennai,27.0,Naukri,4.9,9.0,"Excel, Power Bi, Tableau",Salary Listed by Company
358,Dispute Analyst,Vinculum Solutions,2-5 Yrs,2.0,5.0,,,,"Gandhinagar, Ahmedabad",27.0,Naukri,3.1,146.0,"Payment Reconciliation, Excel, Dispute Resolution",
359,Jr Data Analyst,Synergy Connect Data Innovations,1-2 Yrs,1.0,2.0,,,,Mumbai,13.0,Naukri,4.7,7.0,"Data Analysis, Data Cleansing, Data Visualization",
360,Data Analyst,Jibe Development Services,2-5 Yrs,2.0,5.0,₹ 2.4 - 2L/yr (AmbitionBox estimate),240000.0,200000.0,"Chennai, Navi Mumbai",25.0,Naukri,3.2,54.0,"4th Engineer, QC, Maritime",Estimated by Ambition Box
361,Supply Chain Data Analyst,EMERSON INNOVATION CENTER,2-5 Yrs,2.0,5.0,,,,Pune,180.0,Naukri,4.2,391.0,"Supply chain, SAP, ERP",
362,Procurement Analyst & Admin For UK Clients,Unipath Solutions,3-7 Yrs,3.0,7.0,₹ 4 - 6L/yr,400000.0,600000.0,Ahmedabad,18.0,Naukri,4.2,23.0,"Pivot Table, administrator, procurement",Salary Listed by Company
363,Database Analyst - iAM (5-30 yrs),Careator Technologies Pvt Ltd,5-30 Yrs,5.0,30.0,,,,Bangalore / Bengaluru,30.0,hirist,4.5,15.0,"iAM, Database Apps, Data Analyst",
364,EY - Data Analyst - SQL/Python (2-5 yrs),Ernst & Young,2-5 Yrs,2.0,5.0,,,,Mumbai,60.0,hirist,3.6,9000.0,"SQL, Python, Data Analytics",
365,ADAS Data Analyst_Engineer,Renault India Pvt Ltd,5-6 Yrs,5.0,6.0,,,,Chennai,60.0,Naukri,4.3,465.0,"microsoft, big data, Power point presentation",
366,TBO - Senior Data Analyst (12-22 yrs),TBO.COM,12-22 Yrs,12.0,22.0,,,,Gurgaon / Gurugram,2.0,iimjobs,3.8,14.0,"Data Analytics, Analytics",
367,Lead Data Analyst,Arting Digital,4-7 Yrs,4.0,7.0,,,,Bangalore / Bengaluru,30.0,Naukri,4.8,27.0,"Data analysis, Business intelligence, Analytical",
368,Data Analyst,OneMagnify,5-10 Yrs,5.0,10.0,₹ 14.7 - 15L/yr (AmbitionBox estimate),1470000.0,1500000.0,Chennai,11.0,Naukri,4.0,17.0,"customer analytics, data analysis, data manipulation",Estimated by Ambition Box
369,Better - Senior Data Analyst (3-7 yrs),BMTG Advisors India Private Limited,3-7 Yrs,3.0,7.0,,,,Gurgaon / Gurugram,30.0,iimjobs,3.0,725.0,"Data Analytics, Analytics, Python",
370,PhysicsWallah - Regional Analyst - Python/Data Visualization (2-3 yrs),PhysicsWallah,2-3 Yrs,2.0,3.0,,,,Bangalore / Bengaluru,60.0,hirist,3.8,1200.0,"Python, Data Visualization, Data Analytics",
371,Data Analyst,ADA TECH SOLUTIONS PRIVATE LIMITED,3-5 Yrs,3.0,5.0,₹ 0.5 - 0.7L/yr,50000.0,70000.0,Nashik,30.0,Naukri,3.3,47.0,business needs/requirements and recommend solutions.,Salary Listed by Company
372,Data Quality Analyst,Bigtapp Analytics,3-6 Yrs,3.0,6.0,,,,Chennai,9.0,Naukri,4.3,7.0,"Root Cause Analysis, Data analyst, AI/ML Testing",
373,Data Analyst,S&P Capital IQ (India) Pvt. Ltd,,,,,,,,210.0,First Naukri,4.2,2200.0,,
374,Data Analyst/ Content Management,S&P Capital IQ (India) Pvt. Ltd,0-1 Yrs,0.0,1.0,,,,Ahmedabad,330.0,First Naukri,4.2,2200.0,"Content Management, Data Analysis",
375,Data Analyst_Ahmedabad,S&P Capital IQ (India) Pvt. Ltd,0-1 Yrs,0.0,1.0,,,,Ahmedabad,330.0,First Naukri,4.2,2200.0,Data Analysis,
376,Data Analyst,S&P Capital IQ (India) Pvt. Ltd,,,,,,,,365.0,First Naukri,4.2,2200.0,,
377,Data Analyst - Apprentice,S&P Capital IQ (India) Pvt. Ltd,,,,,,,,365.0,First Naukri,4.2,2200.0,,
378,Technical Lead,Chubb,2-5 Yrs,2.0,5.0,,,,"Nizamabad, Warangal, Hyderabad / Secunderabad",60.0,Naukri,3.8,128.0,"SQL queries, Data analysis, Analytical",
379,Senior Software Engineer,Chubb,4-8 Yrs,4.0,8.0,₹ 13.5 - 20L/yr (AmbitionBox estimate),1350000.0,2000000.0,"Nizamabad, Warangal, Hyderabad / Secunderabad",60.0,Naukri,3.8,128.0,"SQL queries, Data analysis, Analytical",Estimated by Ambition Box
380,Data Analyst (4-10 yrs),Quess Corp Ltd,,,,,,,,60.0,iimjobs,4.0,5800.0,,
381,Supply Chain Data Analyst,Simpli Home Ltd.,2-4 Yrs,2.0,4.0,,,,India,18.0,Naukri,4.1,5.0,"Business Intelligence, Data Analysis, Data Analytics",
382,Data Analyst (Tech BA + Banking),Bigtapp Analytics,5-8 Yrs,5.0,8.0,,,,Chennai,10.0,Naukri,4.3,7.0,"Banking Domain, Business Data Analyst, Data Analysis",
383,Droom -  Data Analyst - Data Science (1-4 yrs),Droom Technology (P) Ltd,1-4 Yrs,1.0,4.0,,,,Gurgaon / Gurugram,30.0,iimjobs,3.5,153.0,"Data Analytics, Data Science, Analytics",
384,Senior Data Analyst - Reporting Analytics & Dashboard (6-12 yrs),HEPL - A Cavinkare Group Company(Consultant),6-12 Yrs,6.0,12.0,,,,Jaipur,27.0,hirist,3.9,106.0,"Data Analytics, SQL, Data Analyst",
385,HEPL - Senior Data Analyst (6-12 yrs),HEPL - A Cavinkare Group Company,6-12 Yrs,6.0,12.0,,,,Jaipur,27.0,iimjobs,3.9,106.0,"Data Analytics, Data Management, Analytics",
386,Data Analyst  - Mohammed Enterprises Tanzania Ltd (METL)- Dubai,Mohammed Enterprises Tanzania Ltd (metl),2-6 Yrs,2.0,6.0,,,,Dubai/Uae,18.0,Naukri,3.8,57.0,"Financial Analysis, erp, Financial Reporting",
387,Data Analyst - SQL/Python (3-5 yrs),Programming.com,3-5 Yrs,3.0,5.0,,,,Bangalore / Bengaluru,14.0,hirist,3.4,7.0,"Data Analyst, Data Analytics, Tableau",
388,Senior Data Analyst - Python/Pyspark/SQL - Insurance (4-6 yrs),Huquo Consulting,4-6 Yrs,4.0,6.0,,,,Delhi ncr,2.0,iimjobs,3.8,14.0,"Analytics, Data Analytics, Data Science",
389,Data Analyst/Senior Data Analyst - SQL/Tableau (3-9 yrs),Huquo Consulting,3-9 Yrs,3.0,9.0,,,,Gurgaon / Gurugram,2.0,hirist,3.8,14.0,"Data Analyst, Data Analytics, SQL",
390,Assistant Manager - Data Analyst (3-6 yrs),HuQuo Consulting Pvt. Ltd.,3-6 Yrs,3.0,6.0,,,,Gurgaon / Gurugram,2.0,iimjobs,3.8,14.0,"Data Analytics, Data Visualization, Data Management",
391,Manager/Senior Data Analyst - Consulting Firm (5-8 yrs),HuQuo Consulting Pvt. Ltd.,5-8 Yrs,5.0,8.0,,,,Gurgaon / Gurugram,2.0,iimjobs,3.8,14.0,"Analytics, Data Analytics, Big Data",
392,Clinical Data Analyst - Epic System (3-6 yrs),Huquo,3-6 Yrs,3.0,6.0,,,,"Hyderabad / Secunderabad, Pune, Gurgaon / Gurugram",2.0,hirist,3.8,14.0,"Clinical Data Management, Clinical SAS, Data Analyst",
393,Data Analyst - Workforce Management - Aspects/Alavaria (3-8 yrs),Huquo Consulting,3-8 Yrs,3.0,8.0,,,,Gurgaon / Gurugram,2.0,iimjobs,3.8,14.0,"Analytics, Statistics, Data Analytics",
394,Data Analyst - Power BI/SQL (1-3 yrs),Huquo Consulting,1-3 Yrs,1.0,3.0,,,,Delhi ncr,2.0,iimjobs,3.8,14.0,"Analytics, Data Analytics, Business Intelligence",
395,Business Analyst/Data Analyst (3-7 yrs),Huquo Consulting,3-7 Yrs,3.0,7.0,,,,Delhi ncr,2.0,iimjobs,3.8,14.0,"Data Analytics, Analytics, SQL",
396,Assistant Manager/Lead Assistant Manager - Data Analytics (3-7 yrs),HuQuo Consulting Pvt. Ltd.,3-7 Yrs,3.0,7.0,,,,Gurgaon / Gurugram,2.0,hirist,3.8,14.0,"Python, SQL, R",
397,Data Analyst - Altreyx & SQL - Acturial Team (1-6 yrs),Huquo Consulting,1-6 Yrs,1.0,6.0,,,,Delhi ncr,2.0,iimjobs,3.8,14.0,"Analytics, Data Analytics, SQL",
398,Senior Data Analyst - Workforce Management/Forecasting - Consulting Firm (5-6 yrs),Huquo Consulting,5-6 Yrs,5.0,6.0,,,,Delhi ncr,2.0,iimjobs,3.8,14.0,"Analytics, Data Analytics, Python",
399,Data Analyst - SAS/SQL/Power BI  - Consulting Firm (4-10 yrs),Huquo Consulting,4-10 Yrs,4.0,10.0,,,,Gurgaon / Gurugram,2.0,iimjobs,3.8,14.0,"Data Modeling, Data Analytics, Business Intelligence",
400,Data Analyst - Machine/Deep Learning Algorithms (2-9 yrs),Huquo Consulting,2-9 Yrs,2.0,9.0,,,,"Delhi ncr, Gurgaon / Gurugram",2.0,hirist,3.8,14.0,"Data Analytics, Data Analyst, Machine Learning",
401,Data Analyst - Consulting Firm (1-3 yrs),HuQuo Consulting Pvt. Ltd.,1-3 Yrs,1.0,3.0,,,,Delhi ncr,2.0,iimjobs,3.8,14.0,"Analytics, Data Analytics, Business Intelligence",
402,Assistant Manager/Lead Assistant Manager - Data Analyst - SQL/Tableau/Alteryx (3-6 yrs),HuQuo Consulting Pvt. Ltd.,3-6 Yrs,3.0,6.0,,,,Gurgaon / Gurugram,2.0,iimjobs,3.8,14.0,"Analytics, Data Analytics, SQL",
403,Data Analyst/Senior Data Analyst - Data Modelling - Power BI/SQL/Snowflake (5-10 yrs),Huquo Consulting,5-10 Yrs,5.0,10.0,,,,Gurgaon / Gurugram,2.0,iimjobs,3.8,14.0,"Data Visualization, Data Analytics, Analytics",
404,Senior Data Analyst/Manager - Spark (5-8 yrs),HuQuo Consulting Pvt. Ltd.,5-8 Yrs,5.0,8.0,,,,Gurgaon / Gurugram,2.0,hirist,3.8,14.0,"Data Analytics, Data Analyst, Spark",
405,Power BI Developer - Data Analytics (3-7 yrs),Www.Huquo.com,3-7 Yrs,3.0,7.0,,,,Gurgaon / Gurugram,2.0,hirist,3.8,14.0,"DAX Power BI, Power BI, Data Analytics",
406,Data Analyst - ETL/Data Warehousing (3-6 yrs),Www.Huquo.com,3-6 Yrs,3.0,6.0,,,,Gurgaon / Gurugram,2.0,hirist,3.8,14.0,"Data Analyst, Data Analytics, Data Warehousing",
407,Senior Business Analyst - Data Analyst - BFS (1-3 yrs),HuQuo Consulting Pvt. Ltd.,1-3 Yrs,1.0,3.0,,,,Gurgaon / Gurugram,2.0,iimjobs,3.8,14.0,"Data Mining, SQL, Python",
408,Lead/Assistant Manager/Data Analyst - Python/SQL (4-6 yrs),HuQuo Consulting Pvt. Ltd.,4-6 Yrs,4.0,6.0,,,,Gurgaon / Gurugram,2.0,iimjobs,3.8,14.0,"Python, SQL, Data Analytics",
409,Data Analyst - SQL/Metadata/ETL Tools (3-8 yrs),Huquo,,,,,,,,2.0,hirist,3.8,14.0,,
410,Data Quality Analyst Lead,Bigtapp Analytics,7-11 Yrs,7.0,11.0,,,,Chennai,11.0,Naukri,4.3,7.0,"Data analyst, ML Testing, AI Testing",
411,Data Analyst - Immediate Joiner - Andheri,Millennium Organisation,0-3 Yrs,0.0,3.0,₹ 1.25 - 2.5L/yr,125000.0,250000.0,Mumbai,29.0,Naukri,3.4,25.0,"Formulas, Advanced Excel, Calculation",Salary Listed by Company
412,Presales Data Analyst,DiLytics Technologies Private Limited,1-10 Yrs,1.0,10.0,,,,Hyderabad / Secunderabad,16.0,Naukri,4.3,11.0,"IT services, Performance management, Data Analyst",
413,Data Analyst - Tableau/Power BI (3-5 yrs),Ds,3-5 Yrs,3.0,5.0,,,,Bangalore / Bengaluru,6.0,hirist,3.6,24.0,"Data Analyst, Data Analytics, Data Modeling",
414,Hindustan Coca Cola Beverages - Data Analyst (3-6 yrs),Coca Cola Beverages Pvt Ltd,3-6 Yrs,3.0,6.0,,,,Bangalore / Bengaluru,90.0,iimjobs,4.2,2500.0,"Data Analytics, Analytics, Data Visualization",
415,Data Analyst,Adidas Group,2-4 Yrs,2.0,4.0,₹ 16 - 25L/yr (AmbitionBox estimate),1600000.0,2500000.0,Gurgaon / Gurugram,365.0,Naukri,4.0,510.0,"SQL, Data processing, SMS",Estimated by Ambition Box
416,Data Analyst,Adidas Group,2-4 Yrs,2.0,4.0,₹ 16 - 25L/yr (AmbitionBox estimate),1600000.0,2500000.0,Gurgaon / Gurugram,365.0,Naukri,4.0,510.0,"SQL, Data processing, SMS",Estimated by Ambition Box
417,Senior Cognos BI Developer - Data Analytics (12-14 yrs),Cortex Consulting Pvt. Ltd.,12-14 Yrs,12.0,14.0,,,,Remote,17.0,hirist,3.1,16.0,"Cognos, Data Modeling, Dimensional Modeling",
418,Senior Spend Data Analyst - BFSI/IT (5-8 yrs),Counselect Services Private Limited,5-8 Yrs,5.0,8.0,,,,Mumbai,60.0,iimjobs,4.2,50.0,"Data Analytics, Analytics, Data Management",
419,Data Analyst Intern,ThoughtCoders,,,,,,,,26.0,Naukri,5.0,6.0,,
420,Data Analyst Trainee,ZCTS,0-1 Yrs,0.0,1.0,,,,Coimbatore,17.0,Naukri,3.8,37.0,"Java, C",
421,TS - Data Analyst,Srivango,4-8 Yrs,4.0,8.0,₹ 9 - 15L/yr,900000.0,1500000.0,Kolkata,5.0,Naukri,4.2,7.0,"Power Bi, Agile, SQL Queries",Salary Listed by Company
422,Data Analyst,Kellton Tech Solutions Ltd,5-10 Yrs,5.0,10.0,,,,Gurgaon / Gurugram,30.0,Naukri,3.0,309.0,"SQL, Python, GIT",
423,Milkbasket - Data Analyst/Senior Data Analyst (3-6 yrs),Milkbasket,3-6 Yrs,3.0,6.0,,,,Gurgaon / Gurugram,30.0,iimjobs,3.8,274.0,"Analytics, SQL, Data Analytics",
424,Data Analyst - R/Python (5-12 yrs),Zelarsoft Pvt.Ltd.,5-12 Yrs,5.0,12.0,,,,Hyderabad / Secunderabad,6.0,hirist,3.5,27.0,"Data Analyst, Data Integrity, R",
425,Power BI (HR),Burns McDonnell,2-3 Yrs,2.0,3.0,,,,Mumbai,240.0,Naukri,4.3,252.0,"Data Analyst, Business analytics, Data management",
426,Senior Executive - Data Analyst,Ecom Express Private Limited,3-5 Yrs,3.0,5.0,₹ 3 - 6L/yr (AmbitionBox estimate),300000.0,600000.0,Gurgaon / Gurugram,270.0,Naukri,4.0,3300.0,"Project implementation, Employee engagement, power bi",Estimated by Ambition Box
427,Data Analyst - Global Support,Siemens Limited,1-4 Yrs,1.0,4.0,,,,Thane,90.0,Naukri,4.2,4200.0,"Business intelligence, Logistics, Data Analyst",
428,Data Analyst,Siemens Limited,0-6 Yrs,0.0,6.0,,,,Bangalore / Bengaluru,150.0,Naukri,4.2,4200.0,"power bi, Data analysis, SQL",
429,Electrical / Energy Expert and Data Analyst,Siemens Limited,6-8 Yrs,6.0,8.0,,,,Thane,90.0,Naukri,4.2,4200.0,"Data Analyst, Project management, Agile",
430,IT Data Analyst,Siemens Limited,5-10 Yrs,5.0,10.0,,,,Bangalore / Bengaluru,120.0,Naukri,4.2,4200.0,"Data Analyst, CRM, Data analysis",
431,Data Analyst ( On Contract ),Electronic Arts,2-3 Yrs,2.0,3.0,,,,Hyderabad / Secunderabad,365.0,Naukri,4.3,67.0,"Analytical skills, tableau, Manager Quality Assurance",
432,Data Analyst at Electronic Arts,Electronic Arts,3-6 Yrs,3.0,6.0,,,,Hyderabad / Secunderabad,1095.0,Naukri,4.3,67.0,"Data analysis, Simulation, Consulting",
433,Data Visualization Expert - Power BI/Qlikview (3-5 yrs),Connexions,3-5 Yrs,3.0,5.0,,,,Bangalore / Bengaluru,30.0,hirist,3.9,11.0,"Data Visualization, Data Visualization Tools, Business Intelligence",
434,Data Analyst Trainee / Engineer,Electrodrive Powertrain Solutions,0-2 Yrs,0.0,2.0,,,,Pune,16.0,Naukri,3.7,35.0,MS Excel,
435,Data Analyst - NA Mobility,Arcadis Consulting India Pvt. Ltd,2-5 Yrs,2.0,5.0,,,,"Bangalore / Bengaluru, Hyderabad / Secunderabad",330.0,Naukri,4.2,191.0,"Qualitative research, Process automation, RDBMS",
436,Senior Data Analyst,Better Mortgage,3-7 Yrs,3.0,7.0,,,,Gurgaon / Gurugram,30.0,Naukri,3.0,725.0,"Data analysis, Automation, Sales",
437,Data Analyst - Qliksense (6-14 yrs),SAR HR Consultancy,6-14 Yrs,6.0,14.0,,,,Gurgaon / Gurugram,11.0,iimjobs,4.5,6.0,"Analytics, Data Analytics, Data Science",
438,MIS Data Analyst-Retail FMCG - Bangalore,The Organic World,2-5 Yrs,2.0,5.0,,,,Bangalore / Bengaluru,6.0,Naukri,4.1,8.0,"Retail MIS, Account data, MIS Operations",
439,Data Analyst,STP Research,1-4 Yrs,1.0,4.0,,,,New Delhi,30.0,Naukri,4.7,4.0,Data Analyst,
440,Jr Data Analyst,Synergy Connect Data Innovations,2-3 Yrs,2.0,3.0,,,,Mumbai,23.0,Naukri,4.7,7.0,"Database Management, Data Analysis, Data Cleansing",
441,Data Analyst - R/Python (3-6 yrs),Kudos India Pvt Ltd,3-6 Yrs,3.0,6.0,,,,Mumbai,10.0,hirist,4.8,4.0,"Data Analyst, R, Python",
442,Data Engineer/ Data Analyst,Chryselys,2-7 Yrs,2.0,7.0,₹ 5 - 13L/yr (AmbitionBox estimate),500000.0,1300000.0,"Chennai, Hyderabad / Secunderabad",13.0,Naukri,3.8,21.0,"Payer, python, Data Engineering",Estimated by Ambition Box
443,Thoucentric - Data Analyst (0-1 yrs),Thoucentric Technology Pvt. Ltd.,0-1 Yrs,0.0,1.0,,,,Bangalore / Bengaluru,30.0,hirist,3.8,89.0,"Data Analyst, Data Analytics, Data Governance",
444,Thoucentric -  Data Analyst (2-5 yrs),Thoucentric Technology Private Limited,2-5 Yrs,2.0,5.0,,,,Bangalore / Bengaluru,30.0,iimjobs,3.8,89.0,"Data Analytics, Analytics, Data Management",
445,Priority Technology Holdings - Data Analyst - SQL/Looker/Tableau (2-5 yrs),Priority Technology Holdings,2-5 Yrs,2.0,5.0,,,,Chandigarh,3.0,hirist,3.1,46.0,"Data Analyst, Data Analytics, Reporting Analytics",
446,Junior Data Analyst,super scholar,0-6 Yrs,0.0,6.0,,,,Mumbai,6.0,Naukri,3.8,11.0,"Data analysis, Excel, Analytical",
447,Senior Data Analyst,PVH,4-6 Yrs,4.0,6.0,,,,"Chennai, Pune, New Delhi
													+4 more",150.0,Naukri,4.3,61.0,"Supply chain, Microstrategy, Logistic regression",
448,SQL Data/BI Analyst - Mumbai (Dadar),Quosphere,3-8 Yrs,3.0,8.0,₹ 6 - 8L/yr,600000.0,800000.0,Mumbai,6.0,Naukri,2.5,20.0,"Power Bi, Data Extraction, SQL Queries",Salary Listed by Company
449,Data Analyst,Clairvoyant India Pvt. Ltd,2-6 Yrs,2.0,6.0,,,,Hyderabad / Secunderabad,60.0,Naukri,4.0,73.0,"Python, Information technology, Analytical",
450,Sr. Data Analyst,Clairvoyant India Pvt. Ltd,5-8 Yrs,5.0,8.0,,,,Hyderabad / Secunderabad,60.0,Naukri,4.0,73.0,"Python, Troubleshooting, Data modeling",
451,Data Analyst,DAZN Group,4-8 Yrs,4.0,8.0,,,,Hyderabad / Secunderabad,60.0,Naukri,4.5,11.0,"SQL, Python, Business intelligence",
452,Data Analyst - Tableau/Power BI (5-10 yrs),Varite India,5-10 Yrs,5.0,10.0,,,,Bangalore / Bengaluru,30.0,hirist,3.7,162.0,"Data Infrastructure, Snowflake DB, DB",
453,Netradyne - Staff Data Analyst - Python/SQL (7-9 yrs),Netradyne Technologies India Pvt Ltd,7-9 Yrs,7.0,9.0,,,,Bangalore / Bengaluru,16.0,hirist,3.6,37.0,"Data Analyst, Data Analytics, Data Pipeline",
454,Senior Manager/Data Analyst (4-10 yrs),C2FO,4-10 Yrs,4.0,10.0,,,,Noida,19.0,hirist,3.6,53.0,"Data Analytics, Business Analyst, SQL",
455,Manager/Senior Manager - Data Governance Products (10-13 yrs),HuQuo,10-13 Yrs,10.0,13.0,,,,Pune,9.0,hirist,3.8,14.0,"Product Management, Data Governance, Data Analyst",
456,Manager/Senior Manager - Data Analyst (2-10 yrs),HuQuo,2-10 Yrs,2.0,10.0,,,,"Delhi ncr, Mumbai, Bangalore / Bengaluru
													+5 more",9.0,iimjobs,3.8,14.0,"Tableau, Python, SQL",
457,Data Analyst - Business Intelligence (1-3 yrs),HuQuo Consulting Pvt. Ltd.,1-3 Yrs,1.0,3.0,,,,Gurgaon / Gurugram,9.0,hirist,3.8,14.0,"Data Analyst, Data Analytics, Reporting Tools",
458,Assistant Manager/Lead Assistant Manager/Manager - Data Analyst - Banking (2-9 yrs),HuQuo,,,,,,,,9.0,iimjobs,3.8,14.0,,
459,Senior Research Analyst - Data Analytics (5-8 yrs),HuQuo,5-8 Yrs,5.0,8.0,,,,Gurgaon / Gurugram,9.0,hirist,3.8,14.0,"IT Research, Data Analytics, Data Analyst",
460,Data Engineer - Python/Hadoop (2-8 yrs),HuQuo,2-8 Yrs,2.0,8.0,,,,Gurgaon / Gurugram,9.0,hirist,3.8,14.0,"Data Analytics, Data Analyst, Python",
